,article,reddit,tweet,type
63,"{u'_id': u'5f75c1d3b8f6fb001b20c78d', u'description': u'Shopify stores could soon allow users to pay for products with Cardano tokens with a new app that removes any payment intermediaries.
An Australian developer has almost completed work on a Cardano ( ADA ) app that will allow all Shopify stores to transact in ADA tokens and other tokens that run on…', u'title': u'Australian dev aims to bring Cardano payments to Shopify stores', u'url': u'https://cryptocontrol.io/r/api/article/5f75c1d3b8f6fb001b20c78d?ref=5f963694c3be7e001761fc25', u'similarArticles': [], u'coins': [{u'tradingSymbol': u'LTC', u'_id': u'59d21e9b83a0523906a45db0', u'name': u'Litecoin', u'slug': u'litecoin'}, {u'tradingSymbol': u'ETH', u'_id': u'59cb59f9b0836b0a63aebc7c', u'name': u'Ethereum', u'slug': u'ethereum'}, {u'tradingSymbol': u'EOS', u'_id': u'59d21e9b83a0523906a45dc5', u'name': u'EOS', u'slug': u'eos'}, {u'tradingSymbol': u'TRX', u'_id': u'59d21e9b83a0523906a45df4', u'name': u'TRON', u'slug': u'tron'}, {u'tradingSymbol': u'BTC', u'_id': u'59cb59e81c073f09e76f614b', u'name': u'Bitcoin', u'slug': u'bitcoin'}, {u'tradingSymbol': u'ADA', u'_id': u'59d21e9b83a0523906a45dbc', u'name': u'Cardano', u'slug': u'cardano'}, {u'tradingSymbol': u'CHX', u'_id': u'5b7ca78b0c38a700190ebdff', u'name': u'Own', u'slug': u'own'}, {u'tradingSymbol': u'DASH', u'_id': u'59d21e9b83a0523906a45db1', u'name': u'Dash', u'slug': u'dash'}], u'publishedAt': u'2020-10-01T10:49:00.000Z', u'thumbnail': u'https://cloudfront.cryptocontrol.io/thumbnails/5f75c1d3b8f6fb001b20c78d-1601552853757.jpg', u'source': {u'url': u'https://cointelegraph.com/', u'_id': u'59d70be3ef8bf95cc2aa2b4f', u'name': u'CoinTelegraph', u'favicon': u'https://assets.cryptocontrol.io/favicons/59d70be3ef8bf95cc2aa2b4f.png'}, u'activityHotness': 0.338508631451, u'words': 419, u'sourceDomain': u'cointelegraph.com', u'hotness': 74146.1412864, u'primaryCategory': u'General', u'originalImageUrl': u'https://images.cointelegraph.com/images/740_aHR0cHM6Ly9zMy5jb2ludGVsZWdyYXBoLmNvbS9zdG9yYWdlL3VwbG9hZHMvdmlldy84MzU0NzFkNzgwMDFiZjdlYjdlMDFlNDdhZGY2YjlmYS5qcGc=.jpg'}",,,article
64,,"{u'isSelf': False, u'hotness': 74143.4659228, u'coin': u'59d21e9b83a0523906a45db0', u'description': u'', u'title': u'Since the launch of the project, Litecoin network has processed over 50 000 000 transactions and more than 66 000 000 (≈79%) coins were mined📊', u'url': u'https://cryptocontrol.io/r/api/reddit/5f75618822fb2000172a942e?ref=5f963694c3be7e001761fc25', u'downvotes': 0, u'comments': 2, u'subreddit': u'litecoin', u'activityHotness': 3.66356164613, u'score': 1, u'publishedAt': u'2020-10-01T04:48:51.000Z', u'__v': 0, u'updatedAt': u'2020-10-06T16:18:51.653Z', u'upvotes': 36, u'_id': u'5f75618822fb2000172a942e', u'id': u'j32294', u'createdAt': u'2020-10-01T04:56:40.480Z'}",,reddit
65,"{u'_id': u'5f755fc00487c50017ef0999', u'description': u'Onecoin victims have joined a consortium that wants the European Parliament to consider a petition seeking the establishment of a compensation fund. The envisioned EU-administered fund will function as an insurance kitty for current and future victims of all crypto fraud. The petitioners are…', u'title': u'Onecoin Victims Join Petition Seeking Establishment of European Crypto Fraud Compensation Fund', u'url': u'https://cryptocontrol.io/r/api/article/5f755fc00487c50017ef0999?ref=5f963694c3be7e001761fc25', u'similarArticles': [], u'coins': [{u'tradingSymbol': u'BTC', u'_id': u'59cb59e81c073f09e76f614b', u'name': u'Bitcoin', u'slug': u'bitcoin'}, {u'tradingSymbol': u'xrp', u'_id': u'59cb5a047ab17a0b2ec00edf', u'name': u'Ripple', u'slug': u'ripple'}, {u'tradingSymbol': u'BCH', u'_id': u'59d21e9b83a0523906a45daf', u'name': u'Bitcoin Cash', u'slug': u'bitcoin-cash'}, {u'tradingSymbol': u'LTC', u'_id': u'59d21e9b83a0523906a45db0', u'name': u'Litecoin', u'slug': u'litecoin'}, {u'tradingSymbol': u'LINK', u'_id': u'59d21e9b83a0523906a45dda', u'name': u'ChainLink', u'slug': u'chainlink'}, {u'tradingSymbol': u'NET', u'_id': u'5cd36d8270d74700100891ad', u'name': u'NEXT', u'slug': u'next'}, {u'tradingSymbol': u'ERC20', u'_id': u'5a1aafdbda3d21115462eead', u'name': u'ERC20', u'slug': u'erc20'}, {u'tradingSymbol': u'DEFI', u'_id': u'5e3844a816c3760019f74b72', u'name': u'Defi', u'slug': u'defi'}], u'publishedAt': u'2020-10-01T04:05:10.000Z', u'thumbnail': u'https://cloudfront.cryptocontrol.io/thumbnails/5f755fc00487c50017ef0999-1601527744200.jpg', u'source': {u'url': u'https://news.bitcoin.com/', u'_id': u'59d71c67ef8bf95cc2ab0147', u'name': u'Bitcoin.com', u'favicon': u'https://assets.cryptocontrol.io/favicons/59d71c67ef8bf95cc2ab0147.png'}, u'activityHotness': 0.333988087774, u'words': 2086, u'sourceDomain': u'news.bitcoin.com', u'hotness': 74145.0150066, u'primaryCategory': u'General', u'originalImageUrl': u'https://news.bitcoin.com/wp-content/uploads/2020/09/onecoin-euro.jpg'}",,,article
66,,,"{u'username': u'SatoshiLite', u'retweetCount': 31, u'language': u'en', u'links': [], u'__v': 0, u'favoriteCount': 0, u'hashtags': [u'MWEB', u'LitecoinFam'], u'publishedAt': u'2020-10-01T02:08:06.000Z', u'symbols': [], u'url': u'https://cryptocontrol.io/r/api/tweet/5f7545193f460b001808cc95?ref=5f963694c3be7e001761fc25', u'activityHotness': 4.93806460126, u'hotness': 74145.2938979, u'isRetweeted': True, u'text': u'RT @BoilingPointLLC: #MWEB is entering its final stages and we have many people to thank. The #LitecoinFam, the @LTCFoundation, @DavidBurke…', u'updatedAt': u'2020-10-01T02:55:22.474Z', u'mentions': [u'BoilingPointLLC', u'LTCFoundation'], u'_id': u'5f7545193f460b001808cc95', u'twitteratiScore': 0, u'id': u'1311488025847685120', u'createdAt': u'2020-10-01T02:55:22.474Z', u'coin': u'59d21e9b83a0523906a45db0'}",tweet
67,"{u'_id': u'5f7533f83f460b0018082fd6', u'description': u'Reports have revealed that Grayscale Investments now controls up to 2.4% of the current BTC supply. In the past week, Grayscale Investments, a crypto fund manager, have experienced an increase in the assets under management in its Bitcoin Trust. This increase occurs at more than $180 million.…', u'title': u'Grayscale Investments Gains Control of 2.4% of Bitcoin’s Supply', u'url': u'https://cryptocontrol.io/r/api/article/5f7533f83f460b0018082fd6?ref=5f963694c3be7e001761fc25', u'similarArticles': [{u'title': u'Grayscale now holds over 2% of Bitcoin supply', u'url': u'https://cryptocontrol.io/r/api/article/5f73177dce717e001a4b4629?ref=5f963694c3be7e001761fc25', u'publishedAt': u'2020-09-29T10:40:00.000Z', u'sourceDomain': u'coinjournal.net', u'_id': u'5f73177dce717e001a4b4629', u'thumbnail': u'https://cloudfront.cryptocontrol.io/thumbnails/5f73177dce717e001a4b4629-1601378173762.jpg'}, {u'title': u'Grayscale Controls 2.4% of Total Bitcoin Supply', u'url': u'https://cryptocontrol.io/r/api/article/5f7316e8ce717e001a4b3cc9?ref=5f963694c3be7e001761fc25', u'publishedAt': u'2020-09-29T10:54:20.000Z', u'sourceDomain': u'ourbitcoinnews.com', u'_id': u'5f7316e8ce717e001a4b3cc9', u'thumbnail': u'https://cloudfront.cryptocontrol.io/thumbnails/5f7316e8ce717e001a4b3cc9-1601378024988.jpg'}, {u'title': u'Grayscale Investments now controls 2.4% of the current BTC supply', u'url': u'https://cryptocontrol.io/r/api/article/5f723d26963fa10019aa0b11?ref=5f963694c3be7e001761fc25', u'publishedAt': u'2020-09-28T18:32:00.000Z', u'sourceDomain': u'cointelegraph.com', u'_id': u'5f723d26963fa10019aa0b11', u'thumbnail': u'https://cloudfront.cryptocontrol.io/thumbnails/5f723d26963fa10019aa0b11-1601322278175.jpg'}, {u'title': u'Bitcoin Investment: Firms Picking Up the Pace Buying Bitcoin', u'url': u'https://cryptocontrol.io/r/api/article/5f72d9d8454b0e00172e3965?ref=5f963694c3be7e001761fc25', u'publishedAt': u'2020-09-29T06:00:06.000Z', u'sourceDomain': u'coininsider.com', u'_id': u'5f72d9d8454b0e00172e3965', u'thumbnail': u'https://cloudfront.cryptocontrol.io/thumbnails/5f72d9d8454b0e00172e3965-1601362392155.png'}], u'coins': [{u'tradingSymbol': u'LTC', u'_id': u'59d21e9b83a0523906a45db0', u'name': u'Litecoin', u'slug': u'litecoin'}, {u'tradingSymbol': u'ZEN', u'_id': u'5df03182d37160001a55431f', u'name': u'Horizen', u'slug': u'horizen'}, {u'tradingSymbol': u'ETH', u'_id': u'59cb59f9b0836b0a63aebc7c', u'name': u'Ethereum', u'slug': u'ethereum'}, {u'tradingSymbol': u'ETC', u'_id': u'59d21e9b83a0523906a45db6', u'name': u'Ethereum Classic', u'slug': u'ethereum-classic'}, {u'tradingSymbol': u'BTC', u'_id': u'59cb59e81c073f09e76f614b', u'name': u'Bitcoin', u'slug': u'bitcoin'}, {u'tradingSymbol': u'BCH', u'_id': u'59d21e9b83a0523906a45daf', u'name': u'Bitcoin Cash', u'slug': u'bitcoin-cash'}, {u'tradingSymbol': u'XLM', u'_id': u'59d21e9b83a0523906a45dcb', u'name': u'Stellar Lumens', u'slug': u'stellar'}, {u'tradingSymbol': u'ZEC', u'_id': u'59d21e9b83a0523906a45dbb', u'name': u'Zcash', u'slug': u'zcash'}], u'publishedAt': u'2020-10-01T00:46:41.000Z', u'thumbnail': u'https://cloudfront.cryptocontrol.io/thumbnails/5f7533f83f460b0018082fd6-1601516536584.jpg', u'source': {u'url': u'https://altcoinbuzz.io/', u'_id': u'5c10e3983c4bad0016a0f5fd', u'name': u'Altcoinbuzz', u'favicon': u'https://assets.cryptocontrol.io/favicons/5c10e3983c4bad0016a0f5fd.png'}, u'activityHotness': 4.9070839746, u'words': 422, u'sourceDomain': u'', u'hotness': 74149.0367599, u'primaryCategory': u'General', u'originalImageUrl': u'https://www.altcoinbuzz.io/wp-content/uploads/2020/09/Grayscale-Investments-Gains-Control-of-2.4-of-Bitcoins-Supply.jpg'}",,,article
68,"{u'_id': u'5f7525393f460b0018079c54', u'description': u'During the first half of the year, betting portals that allow people to wager cryptocurrencies on the upcoming U.S. election had shown Donald Trump winning the election. However, after Tuesday evening’s Presidential Debate, betting markets like Cloudbet show Joe Biden’s chances of getting elected is…', u'title': u'Crypto Bets on the US Election Show Joe Biden Winning the Presidency by 60%', u'url': u'https://cryptocontrol.io/r/api/article/5f7525393f460b0018079c54?ref=5f963694c3be7e001761fc25', u'similarArticles': [], u'coins': [{u'tradingSymbol': u'BTC', u'_id': u'59cb59e81c073f09e76f614b', u'name': u'Bitcoin', u'slug': u'bitcoin'}, {u'tradingSymbol': u'xrp', u'_id': u'59cb5a047ab17a0b2ec00edf', u'name': u'Ripple', u'slug': u'ripple'}, {u'tradingSymbol': u'BCH', u'_id': u'59d21e9b83a0523906a45daf', u'name': u'Bitcoin Cash', u'slug': u'bitcoin-cash'}, {u'tradingSymbol': u'LTC', u'_id': u'59d21e9b83a0523906a45db0', u'name': u'Litecoin', u'slug': u'litecoin'}, {u'tradingSymbol': u'SHOW', u'_id': u'5a7b931302ac032bc997820d', u'name': u'Show', u'slug': u'show'}, {u'tradingSymbol': u'CS', u'_id': u'5a9b3705a8134644d04a5d85', u'name': u'Credits', u'slug': u'credits'}, {u'tradingSymbol': u'REP', u'_id': u'59d21e9b83a0523906a45dcc', u'name': u'Augur', u'slug': u'augur'}, {u'tradingSymbol': u'LINK', u'_id': u'59d21e9b83a0523906a45dda', u'name': u'ChainLink', u'slug': u'chainlink'}, {u'tradingSymbol': u'NET', u'_id': u'5cd36d8270d74700100891ad', u'name': u'NEXT', u'slug': u'next'}, {u'tradingSymbol': u'ERC20', u'_id': u'5a1aafdbda3d21115462eead', u'name': u'ERC20', u'slug': u'erc20'}, {u'tradingSymbol': u'DEFI', u'_id': u'5e3844a816c3760019f74b72', u'name': u'Defi', u'slug': u'defi'}], u'publishedAt': u'2020-09-30T23:30:31.000Z', u'thumbnail': u'https://cloudfront.cryptocontrol.io/thumbnails/5f7525393f460b0018079c54-1601512761485.jpg', u'source': {u'url': u'https://news.bitcoin.com/', u'_id': u'59d71c67ef8bf95cc2ab0147', u'name': u'Bitcoin.com', u'favicon': u'https://assets.cryptocontrol.io/favicons/59d71c67ef8bf95cc2ab0147.png'}, u'activityHotness': 0.336555989216, u'words': 2036, u'sourceDomain': u'news.bitcoin.com', u'hotness': 74144.2546578, u'primaryCategory': u'General', u'originalImageUrl': u'https://news.bitcoin.com/wp-content/uploads/2020/09/crypto-bets-on-the-us-election-show-joe-biden-winning-the-presidency-by-60.jpg'}",,,article
69,"{u'_id': u'5f75d238272c480017702bd7', u'description': u'Disclaimer: The text below is a press release that was not written by Cryptonews.com.  Before the Covid-19 pandemic, smart working was still a niche paradigm adopted by few software startups, freelancers, and nomad workers. Despite the unfortunate consequences of Covid-19 in the worldwide economy,…', u'title': u'Sensitrust: Smart Working empowered by Artificial Intelligence and Blockchain Technologies', u'url': u'https://cryptocontrol.io/r/api/article/5f75d238272c480017702bd7?ref=5f963694c3be7e001761fc25', u'similarArticles': [], u'coins': [{u'tradingSymbol': u'BTC', u'_id': u'59cb59e81c073f09e76f614b', u'name': u'Bitcoin', u'slug': u'bitcoin'}, {u'tradingSymbol': u'ETH', u'_id': u'59cb59f9b0836b0a63aebc7c', u'name': u'Ethereum', u'slug': u'ethereum'}, {u'tradingSymbol': u'LTC', u'_id': u'59d21e9b83a0523906a45db0', u'name': u'Litecoin', u'slug': u'litecoin'}, {u'tradingSymbol': u'TRX', u'_id': u'59d21e9b83a0523906a45df4', u'name': u'TRON', u'slug': u'tron'}, {u'tradingSymbol': u'EGCC', u'_id': u'5b1b1885bad05a000f195d03', u'name': u'Engine', u'slug': u'engine'}, {u'tradingSymbol': u'NET', u'_id': u'5cd36d8270d74700100891ad', u'name': u'NEXT', u'slug': u'next'}], u'publishedAt': u'2020-09-30T21:33:00.000Z', u'thumbnail': u'https://cloudfront.cryptocontrol.io/thumbnails/5f75d238272c480017702bd7-1601557048948.png', u'source': {u'url': u'https://cryptonews.com/', u'_id': u'5c8fbb44a4410000111f614b', u'name': u'CryptoNews', u'favicon': u'https://assets.cryptocontrol.io/favicons/5c8fbb44a4410000111f614b.png'}, u'activityHotness': 0.26582280766, u'words': 631, u'sourceDomain': u'cryptonews.com', u'hotness': 74143.8574895, u'primaryCategory': u'Blockchain', u'originalImageUrl': u'https://cimg.co/w/articles/0/5f7/5be543a31c.png'}",,,article
70,"{u'_id': u'5f74fa89e2fb280017f3bd30', u'description': u'Catch up on the latest crypto market news at The Currency Analytics.
Nexo is now named an official credit partner to the Litecoin Foundation. Both of these two enterprises are now bringing…
', u'title': u'Nexo Finance are now an Official Partner to the Litecoin Foundation Redesigning Financial Options', u'url': u'https://cryptocontrol.io/r/api/article/5f74fa89e2fb280017f3bd30?ref=5f963694c3be7e001761fc25', u'similarArticles': [{u'title': u'Nexo and Litecoin partnership to change the crypto ecosystem', u'url': u'https://cryptocontrol.io/r/api/article/5f71eaddd2caa40017d7aba7?ref=5f963694c3be7e001761fc25', u'publishedAt': u'2020-09-28T13:15:10.000Z', u'sourceDomain': u'en.cryptonomist.ch', u'_id': u'5f71eaddd2caa40017d7aba7', u'thumbnail': u'https://cloudfront.cryptocontrol.io/thumbnails/5f71eaddd2caa40017d7aba7-1601301213970.jpg'}], u'coins': [{u'tradingSymbol': u'CREDIT', u'_id': u'5e3844a916c3760019f74c8b', u'name': u'CREDIT', u'slug': u'credit'}, {u'tradingSymbol': u'LTC', u'_id': u'59d21e9b83a0523906a45db0', u'name': u'Litecoin', u'slug': u'litecoin'}, {u'tradingSymbol': u'NEXO', u'_id': u'5afcc605ed3b0e000f40cf03', u'name': u'Nexo', u'slug': u'nexo'}, {u'tradingSymbol': u'LINK', u'_id': u'59d21e9b83a0523906a45dda', u'name': u'ChainLink', u'slug': u'chainlink'}, {u'tradingSymbol': u'TRX', u'_id': u'59d21e9b83a0523906a45df4', u'name': u'TRON', u'slug': u'tron'}], u'publishedAt': u'2020-09-30T20:28:30.000Z', u'thumbnail': u'https://cloudfront.cryptocontrol.io/thumbnails/5f74fa89e2fb280017f3bd30-1601501835957.jpg', u'source': {u'url': u'https://thecurrencyanalytics.com/', u'_id': u'5c509bf423b00e00101f000b', u'name': u'TheCurrencyAnalytics', u'favicon': u'https://assets.cryptocontrol.io/favicons/5c509bf423b00e00101f000b.jpg'}, u'activityHotness': 1.79095425049, u'words': 437, u'sourceDomain': u'thecurrencyanalytics.com', u'hotness': 74145.2034543, u'primaryCategory': u'General', u'originalImageUrl': u'https://cdn.thecurrencyanalytics.com/wp-content/uploads/2020/09/NexoFinanceLitecoinFoundation-300x300.jpg'}",,,article
71,,"{u'isSelf': False, u'hotness': 74141.8223788, u'coin': u'59d21e9b83a0523906a45db0', u'description': u'', u'title': u'@DavidBurkett38: I guess there's supposed to be an #MWEB testnet launch or something 🙂 - I'll be coding, testing, and documenting right up to the deadline of course. All technical users are encouraged to join - Non-nerds may have to wait a few days before getting involved 😔', u'url': u'https://cryptocontrol.io/r/api/reddit/5f74e41517c78500172d317f?ref=5f963694c3be7e001761fc25', u'downvotes': 0, u'comments': 1, u'subreddit': u'litecoin', u'activityHotness': 3.51154543883, u'score': 3, u'publishedAt': u'2020-09-30T19:51:54.000Z', u'__v': 0, u'updatedAt': u'2020-10-06T16:18:51.653Z', u'upvotes': 32, u'_id': u'5f74e41517c78500172d317f', u'id': u'j2tci8', u'createdAt': u'2020-09-30T20:01:25.592Z'}",,reddit
72,,,"{u'username': u'SatoshiLite', u'retweetCount': 7, u'language': u'und', u'links': [], u'__v': 0, u'favoriteCount': 33, u'hashtags': [u'MWEB'], u'publishedAt': u'2020-09-30T18:44:46.000Z', u'symbols': [], u'url': u'https://cryptocontrol.io/r/api/tweet/5f74d2e332de06001a89e905?ref=5f963694c3be7e001761fc25', u'activityHotness': 4.11414718952, u'hotness': 74143.238499, u'isRetweeted': False, u'text': u'#MWEB https://t.co/qWiVFkhMKK', u'updatedAt': u'2020-09-30T18:48:04.178Z', u'mentions': [], u'_id': u'5f74d2e332de06001a89e905', u'twitteratiScore': 0, u'id': u'1311376460158955521', u'createdAt': u'2020-09-30T18:48:04.178Z', u'coin': u'59d21e9b83a0523906a45db0'}",tweet
73,"{u'_id': u'5f74d57532de06001a89f9e7', u'description': u'Aspire (ASP) is the first digital asset creation platform to resist both mining exploits and 51 percent attacks common to proof-of-work blockchains. Its fees are a tiny fraction of creating assets on Ethereum or other platforms due to its innovative Aspire Gas (GASP) blockchain Both tokens will be…', u'title': u'Bitcoin.com Exchange to List Aspire and Aspire Gas as Newest Digital Asset Creation Platform Comes to Market ', u'url': u'https://cryptocontrol.io/r/api/article/5f74d57532de06001a89f9e7?ref=5f963694c3be7e001761fc25', u'similarArticles': [], u'coins': [{u'tradingSymbol': u'BTC', u'_id': u'59cb59e81c073f09e76f614b', u'name': u'Bitcoin', u'slug': u'bitcoin'}, {u'tradingSymbol': u'xrp', u'_id': u'59cb5a047ab17a0b2ec00edf', u'name': u'Ripple', u'slug': u'ripple'}, {u'tradingSymbol': u'BCH', u'_id': u'59d21e9b83a0523906a45daf', u'name': u'Bitcoin Cash', u'slug': u'bitcoin-cash'}, {u'tradingSymbol': u'LTC', u'_id': u'59d21e9b83a0523906a45db0', u'name': u'Litecoin', u'slug': u'litecoin'}, {u'tradingSymbol': u'LINK', u'_id': u'59d21e9b83a0523906a45dda', u'name': u'ChainLink', u'slug': u'chainlink'}, {u'tradingSymbol': u'NET', u'_id': u'5cd36d8270d74700100891ad', u'name': u'NEXT', u'slug': u'next'}, {u'tradingSymbol': u'ERC20', u'_id': u'5a1aafdbda3d21115462eead', u'name': u'ERC20', u'slug': u'erc20'}, {u'tradingSymbol': u'DEFI', u'_id': u'5e3844a816c3760019f74b72', u'name': u'Defi', u'slug': u'defi'}, {u'tradingSymbol': u'GAS', u'_id': u'59d21e9b83a0523906a45dc3', u'name': u'Gas', u'slug': u'gas'}], u'publishedAt': u'2020-09-30T18:30:01.000Z', u'thumbnail': u'https://cloudfront.cryptocontrol.io/thumbnails/5f74d57532de06001a89f9e7-1601492341498.jpeg', u'source': {u'url': u'https://news.bitcoin.com/', u'_id': u'59d71c67ef8bf95cc2ab0147', u'name': u'Bitcoin.com', u'favicon': u'https://assets.cryptocontrol.io/favicons/59d71c67ef8bf95cc2ab0147.png'}, u'activityHotness': 0.298237982884, u'words': 1359, u'sourceDomain': u'news.bitcoin.com', u'hotness': 74143.3816176, u'primaryCategory': u'Exchanges', u'originalImageUrl': u'https://news.bitcoin.com/wp-content/uploads/2020/09/3dd91e98-88cc-470b-be28-0ff55d524df2.jpeg'}",,,article
74,"{u'_id': u'5f74c6e032de06001a89764e', u'description': u'Stepping up its enforcement against a futures trading service, the Commodity Futures Trading Commission (CFTC) claimed that the company had set up shop in the United States illegally. Charges were filed against a financial services company called Laino Group earlier this week. Based in St. Vincent,…', u'title': u'Crypto Futures Provider Charged by CFTC for Violating Registration...', u'url': u'https://cryptocontrol.io/r/api/article/5f74c6e032de06001a89764e?ref=5f963694c3be7e001761fc25', u'similarArticles': [{u'title': u'CFTC Charges Crypto Futures Provider for Violating Registration Requirements ', u'url': u'https://cryptocontrol.io/r/api/article/5f73060467445d0017edb2cc?ref=5f963694c3be7e001761fc25', u'publishedAt': u'2020-09-29T09:47:55.000Z', u'sourceDomain': u'insidebitcoins.com', u'_id': u'5f73060467445d0017edb2cc', u'thumbnail': u'https://cloudfront.cryptocontrol.io/thumbnails/5f73060467445d0017edb2cc-1601373700578.jpg'}, {u'title': u'Cryptocurrency Regulations in Canada', u'url': u'https://cryptocontrol.io/r/api/article/5f724233a5382b0017f4ae39?ref=5f963694c3be7e001761fc25', u'publishedAt': u'2020-09-28T19:42:11.000Z', u'sourceDomain': u'btcwires.com', u'_id': u'5f724233a5382b0017f4ae39', u'thumbnail': u'https://cloudfront.cryptocontrol.io/thumbnails/5f724233a5382b0017f4ae39-1601323571203.jpg'}, {u'title': u'House Ag Committee leader talks new bills to treat more cryptos like commodities', u'url': u'https://cryptocontrol.io/r/api/article/5f722cdc963fa10019a9778c?ref=5f963694c3be7e001761fc25', u'publishedAt': u'2020-09-28T18:15:02.000Z', u'sourceDomain': u'cointelegraph.com', u'_id': u'5f722cdc963fa10019a9778c', u'thumbnail': u'https://cloudfront.cryptocontrol.io/thumbnails/5f722cdc963fa10019a9778c-1601318112360.jpg'}], u'coins': [{u'tradingSymbol': u'BTC', u'_id': u'59cb59e81c073f09e76f614b', u'name': u'Bitcoin', u'slug': u'bitcoin'}, {u'tradingSymbol': u'LTC', u'_id': u'59d21e9b83a0523906a45db0', u'name': u'Litecoin', u'slug': u'litecoin'}], u'publishedAt': u'2020-09-30T17:22:50.000Z', u'thumbnail': u'https://cloudfront.cryptocontrol.io/thumbnails/5f74c6e032de06001a89764e-1601488608258.jpg', u'source': {u'url': u'https://tokenhell.com/', u'_id': u'5d79ee2e26ceed001aa0514b', u'name': u'Tokenhell', u'favicon': u'https://assets.cryptocontrol.io/favicons/5d79ee2e26ceed001aa0514b.png'}, u'activityHotness': 4.77664416612, u'words': 523, u'sourceDomain': u'tokenhell.com', u'hotness': 74147.6734034, u'primaryCategory': u'General', u'originalImageUrl': u'https://tokenhell.com/wp-content/uploads/cryptocurrency-3423267_1280-2-1.jpg'}",,,article
75,,,"{u'username': u'SatoshiLite', u'retweetCount': 10, u'language': u'en', u'links': [], u'__v': 0, u'favoriteCount': 0, u'hashtags': [u'Litecoin', u'MWEB', u'fungibility'], u'publishedAt': u'2020-09-30T16:34:29.000Z', u'symbols': [], u'url': u'https://cryptocontrol.io/r/api/tweet/5f74b4e22cee63001b562ace?ref=5f963694c3be7e001761fc25', u'activityHotness': 3.80666248977, u'hotness': 74142.5691162, u'isRetweeted': True, u'text': u'RT @LTCFoundation: Hide your kids.
Hide your wife.

#Litecoin #MWEB #fungibility', u'updatedAt': u'2020-09-30T16:40:03.071Z', u'mentions': [u'LTCFoundation'], u'_id': u'5f74b4e22cee63001b562ace', u'twitteratiScore': 0, u'id': u'1311343673070641152', u'createdAt': u'2020-09-30T16:40:03.071Z', u'coin': u'59d21e9b83a0523906a45db0'}",tweet
76,"{u'_id': u'5f74b63f6d312c001ce431fd', u'description': u'Grayscale Investments, LLC offers institutional investors the simplest custodial solution. Through the Grayscale Bitcoin Trust (GBTC), high-net-worth investors and institutions can gain bitcoin exposure without having to hold the asset. GBTC has purchased a gargantuan amount of BTC since the…', u'title': u'Grayscale Now Owns 2.5% Of All Bitcoin In Circulation After Increasing Its Reserves By 17,100 BTC', u'url': u'https://cryptocontrol.io/r/api/article/5f74b63f6d312c001ce431fd?ref=5f963694c3be7e001761fc25', u'similarArticles': [], u'coins': [{u'tradingSymbol': u'BTC', u'_id': u'59cb59e81c073f09e76f614b', u'name': u'Bitcoin', u'slug': u'bitcoin'}, {u'tradingSymbol': u'CHX', u'_id': u'5b7ca78b0c38a700190ebdff', u'name': u'Own', u'slug': u'own'}, {u'tradingSymbol': u'ETH', u'_id': u'59cb59f9b0836b0a63aebc7c', u'name': u'Ethereum', u'slug': u'ethereum'}, {u'tradingSymbol': u'ETC', u'_id': u'59d21e9b83a0523906a45db6', u'name': u'Ethereum Classic', u'slug': u'ethereum-classic'}, {u'tradingSymbol': u'LTC', u'_id': u'59d21e9b83a0523906a45db0', u'name': u'Litecoin', u'slug': u'litecoin'}], u'publishedAt': u'2020-09-30T16:33:22.000Z', u'thumbnail': u'https://cloudfront.cryptocontrol.io/thumbnails/5f74b63f6d312c001ce431fd-1601484352000.jpg', u'source': {u'url': u'https://zycrypto.com', u'_id': u'5adc20e7ec0af7be3539d369', u'name': u'ZyCrypto', u'favicon': u'https://assets.cryptocontrol.io/favicons/5adc20e7ec0af7be3539d369.png'}, u'activityHotness': 0.328033948405, u'words': 426, u'sourceDomain': u'zycrypto.com', u'hotness': 74143.0873858, u'primaryCategory': u'General', u'originalImageUrl': u'https://zycrypto.com/wp-content/uploads/2020/09/Grayscale-Now-Owns-2.5-Of-All-Bitcoin-In-Circulation-After-Increasing-Its-Reserves-By-17100-BTC.jpg'}",,,article
77,,,"{u'username': u'SatoshiLite', u'retweetCount': 18, u'language': u'en', u'links': [], u'__v': 0, u'favoriteCount': 0, u'hashtags': [u'MWEB'], u'publishedAt': u'2020-09-30T16:21:46.000Z', u'symbols': [], u'url': u'https://cryptocontrol.io/r/api/tweet/5f74b1232cee63001b5610af?ref=5f963694c3be7e001761fc25', u'activityHotness': 4.39444915467, u'hotness': 74143.1215788, u'isRetweeted': True, u'text': u'RT @DavidBurkett38: I guess there's supposed to be an #MWEB testnet launch or something🙂

I'll be coding, testing, and documenting right up…', u'updatedAt': u'2020-09-30T16:24:03.760Z', u'mentions': [u'DavidBurkett38'], u'_id': u'5f74b1232cee63001b5610af', u'twitteratiScore': 0, u'id': u'1311340469733871616', u'createdAt': u'2020-09-30T16:24:03.760Z', u'coin': u'59d21e9b83a0523906a45db0'}",tweet
