,article,reddit,tweet,type
0,"{u'_id': u'5f7ca1963cd0430017ff13e9', u'description': u'Source: Adobe/ I-Wei Huang Get your daily, bite-sized digest of cryptoasset and blockchain-related news – investigating the stories flying under the radar of today’s crypto news. Regulation news In the UK, the Financial Conduct Authority (FCA) banned the sale of derivatives and exchange-traded notes…', u'title': u'New Crypto Ban, New Index, Litecoin's MimbleWimble Testnet + More News', u'url': u'https://cryptocontrol.io/r/api/article/5f7ca1963cd0430017ff13e9?ref=5f963694c3be7e001761fc25', u'similarArticles': [], u'coins': [{u'tradingSymbol': u'BTC', u'_id': u'59cb59e81c073f09e76f614b', u'name': u'Bitcoin', u'slug': u'bitcoin'}, {u'tradingSymbol': u'ANT', u'_id': u'59d21e9b83a0523906a45df9', u'name': u'Aragon', u'slug': u'aragon'}, {u'tradingSymbol': u'DEFI', u'_id': u'5e3844a816c3760019f74b72', u'name': u'Defi', u'slug': u'defi'}, {u'tradingSymbol': u'LTC', u'_id': u'59d21e9b83a0523906a45db0', u'name': u'Litecoin', u'slug': u'litecoin'}, {u'tradingSymbol': u'NET', u'_id': u'5cd36d8270d74700100891ad', u'name': u'NEXT', u'slug': u'next'}, {u'tradingSymbol': u'xrp', u'_id': u'59cb5a047ab17a0b2ec00edf', u'name': u'Ripple', u'slug': u'ripple'}, {u'tradingSymbol': u'RIF', u'_id': u'5d462002e19efe001b381188', u'name': u'RIF Token', u'slug': u'rif-token'}, {u'tradingSymbol': u'ETH', u'_id': u'59cb59f9b0836b0a63aebc7c', u'name': u'Ethereum', u'slug': u'ethereum'}, {u'tradingSymbol': u'dai', u'_id': u'5a7b930d02ac032bc99781ba', u'name': u'Dai', u'slug': u'dai'}, {u'tradingSymbol': u'XRP', u'_id': u'5de5a582d37160001ab4bdff', u'name': u'XRP', u'slug': u'xrp'}], u'publishedAt': u'2020-10-06T16:54:51.000Z', u'thumbnail': u'https://cloudfront.cryptocontrol.io/thumbnails/5f7ca1963cd0430017ff13e9-1602003350062.jpg', u'source': {u'url': u'https://cryptonews.com/', u'_id': u'5c8fbb44a4410000111f614b', u'name': u'CryptoNews', u'favicon': u'https://assets.cryptocontrol.io/favicons/5c8fbb44a4410000111f614b.png'}, u'activityHotness': 0.403399098567, u'words': 981, u'sourceDomain': u'cryptonews.com', u'hotness': 74167.2224269, u'primaryCategory': u'General', u'originalImageUrl': u'https://cimg.co/w/articles/0/5f7/ca1790b5e9.jpg'}",,,article
1,"{u'_id': u'5f7c8a35e0c44f001bfe1b92', u'description': u'The testnet for privacy protocol MimbleWimble is live on Litecoin as developers seek to make the network more private', u'title': u'Litecoin price unchanged as MimbleWimble testnet goes live', u'url': u'https://cryptocontrol.io/r/api/article/5f7c8a35e0c44f001bfe1b92?ref=5f963694c3be7e001761fc25', u'similarArticles': [], u'coins': [{u'tradingSymbol': u'LTC', u'_id': u'59d21e9b83a0523906a45db0', u'name': u'Litecoin', u'slug': u'litecoin'}, {u'tradingSymbol': u'NET', u'_id': u'5cd36d8270d74700100891ad', u'name': u'NEXT', u'slug': u'next'}, {u'tradingSymbol': u'BTC', u'_id': u'59cb59e81c073f09e76f614b', u'name': u'Bitcoin', u'slug': u'bitcoin'}], u'publishedAt': u'2020-10-06T14:27:52.000Z', u'thumbnail': u'https://cloudfront.cryptocontrol.io/thumbnails/5f7c8a35e0c44f001bfe1b92-1601997365384.jpg', u'source': {u'url': u'http://coinjournal.net', u'_id': u'59d71bc4ef8bf95cc2aaf570', u'name': u'CoinJournal', u'favicon': u'https://assets.cryptocontrol.io/favicons/59d71bc4ef8bf95cc2aaf570.png'}, u'activityHotness': 0.312942147398, u'words': 518, u'sourceDomain': u'coinjournal.net', u'hotness': 74166.7236829, u'primaryCategory': u'Analysis', u'originalImageUrl': u'https://coinjournal.net/wp-content/uploads/2020/10/02-LTC.jpg'}",,,article
2,"{u'_id': u'5f7c7c30545af10017ccd76c', u'description': u'Bloomberg analyst Mike McGlone has predicted that the price of bitcoin will hit $100,000 by 2025. McGlone premised his argument on past bitcoin trends, including the period in which the price took four years to go from $1,000 to $10,000 in 2017. “So, doubling that time frame for maturation could get…', u'title': u'Bitcoin To Hit $100,000 in Five Years as Demand and Adoption Increase – Report', u'url': u'https://cryptocontrol.io/r/api/article/5f7c7c30545af10017ccd76c?ref=5f963694c3be7e001761fc25', u'similarArticles': [], u'coins': [{u'tradingSymbol': u'BTC', u'_id': u'59cb59e81c073f09e76f614b', u'name': u'Bitcoin', u'slug': u'bitcoin'}, {u'tradingSymbol': u'xrp', u'_id': u'59cb5a047ab17a0b2ec00edf', u'name': u'Ripple', u'slug': u'ripple'}, {u'tradingSymbol': u'BCH', u'_id': u'59d21e9b83a0523906a45daf', u'name': u'Bitcoin Cash', u'slug': u'bitcoin-cash'}, {u'tradingSymbol': u'LTC', u'_id': u'59d21e9b83a0523906a45db0', u'name': u'Litecoin', u'slug': u'litecoin'}, {u'tradingSymbol': u'DEFI', u'_id': u'5e3844a816c3760019f74b72', u'name': u'Defi', u'slug': u'defi'}, {u'tradingSymbol': u'BLT', u'_id': u'5a7b930b02ac032bc9978197', u'name': u'Bloom', u'slug': u'bloomtoken'}, {u'tradingSymbol': u'DEX', u'_id': u'5be61f883c4bad00168c1da8', u'name': u'DEX', u'slug': u'dex'}, {u'tradingSymbol': u'DTA', u'_id': u'5a7b931102ac032bc99781f1', u'name': u'DATA', u'slug': u'data'}, {u'tradingSymbol': u'XMR', u'_id': u'59d21e9b83a0523906a45db5', u'name': u'Monero', u'slug': u'monero'}, {u'tradingSymbol': u'ETH', u'_id': u'59cb59f9b0836b0a63aebc7c', u'name': u'Ethereum', u'slug': u'ethereum'}, {u'tradingSymbol': u'NET', u'_id': u'5cd36d8270d74700100891ad', u'name': u'NEXT', u'slug': u'next'}, {u'tradingSymbol': u'key', u'_id': u'5afcc60ced3b0e000f40d55c', u'name': u'KEY', u'slug': u'key'}, {u'tradingSymbol': u'BIT', u'_id': u'59d8e9a849f28d56105674fd', u'name': u'First Bitcoin', u'slug': u'first-bitcoin'}, {u'tradingSymbol': u'TOP', u'_id': u'5e3844aa16c3760019f74f7b', u'name': u'TOP', u'slug': u'top'}, {u'tradingSymbol': u'USDT', u'_id': u'59d21e9b83a0523906a45dbe', u'name': u'Tether', u'slug': u'tether'}, {u'tradingSymbol': u'READ', u'_id': u'5a7b931502ac032bc997822c', u'name': u'Read', u'slug': u'read'}], u'publishedAt': u'2020-10-06T13:30:21.000Z', u'thumbnail': u'https://cloudfront.cryptocontrol.io/thumbnails/5f7c7c30545af10017ccd76c-1601993776613.jpg', u'source': {u'url': u'https://news.bitcoin.com/', u'_id': u'59d71c67ef8bf95cc2ab0147', u'name': u'Bitcoin.com', u'favicon': u'https://assets.cryptocontrol.io/favicons/59d71c67ef8bf95cc2ab0147.png'}, u'activityHotness': 0.424063731665, u'words': 1833, u'sourceDomain': u'news.bitcoin.com', u'hotness': 74166.675036, u'primaryCategory': u'General', u'originalImageUrl': u'https://news.bitcoin.com/wp-content/uploads/2020/10/bitcoin-to-hit-100000-in-five-years-as-demand-and-adoption-increase-report.jpg'}",,,article
3,"{u'_id': u'5f7c7883545af10017ccbd86', u'description': u'According to Europol, privacy-enhancing wallet services and cryptocurrencies are the 'top threats' in the cybercrime space. Also, the European law enforcement agency noted that Monero is becoming very popular as a transaction tool on the Darkweb.
', u'title': u'Monero (XMR) Becoming the Most Popular Cryptocurrency on Darkweb: Europol', u'url': u'https://cryptocontrol.io/r/api/article/5f7c7883545af10017ccbd86?ref=5f963694c3be7e001761fc25', u'similarArticles': [], u'coins': [{u'tradingSymbol': u'XMR', u'_id': u'59d21e9b83a0523906a45db5', u'name': u'Monero', u'slug': u'monero'}, {u'tradingSymbol': u'ZEC', u'_id': u'59d21e9b83a0523906a45dbb', u'name': u'Zcash', u'slug': u'zcash'}, {u'tradingSymbol': u'ETH', u'_id': u'59cb59f9b0836b0a63aebc7c', u'name': u'Ethereum', u'slug': u'ethereum'}, {u'tradingSymbol': u'LTC', u'_id': u'59d21e9b83a0523906a45db0', u'name': u'Litecoin', u'slug': u'litecoin'}, {u'tradingSymbol': u'exmr', u'_id': u'5b6249888cb221000f08d39b', u'name': u'Ethereum Monero', u'slug': u'ethereum-monero'}, {u'tradingSymbol': u'oio', u'_id': u'5c05c3873c4bad0016c2504d', u'name': u'Online', u'slug': u'online'}, {u'tradingSymbol': u'NET', u'_id': u'5cd36d8270d74700100891ad', u'name': u'NEXT', u'slug': u'next'}, {u'tradingSymbol': u'TOP', u'_id': u'5e3844aa16c3760019f74f7b', u'name': u'TOP', u'slug': u'top'}, {u'tradingSymbol': u'alt', u'_id': u'59d21e9b83a0523906a45f2b', u'name': u'Altcoin', u'slug': u'altcoin-alt'}], u'publishedAt': u'2020-10-06T13:15:59.000Z', u'thumbnail': u'https://cloudfront.cryptocontrol.io/thumbnails/5f7c7883545af10017ccbd86-1601992835977.jpg', u'source': {u'url': u'https://cryptopotato.com/', u'_id': u'5ce406880175730010f47558', u'name': u'Crypto Potato', u'favicon': u'https://assets.cryptocontrol.io/favicons/5ce406880175730010f47558.png'}, u'activityHotness': 0.373436750942, u'words': 570, u'sourceDomain': u'cryptopotato.com', u'hotness': 74166.5845016, u'primaryCategory': u'General', u'originalImageUrl': u'https://cryptopotato.com/wp-content/uploads/2020/10/dark_web_monero_cover.jpg'}",,,article
4,,"{u'isSelf': False, u'hotness': 74161.5171287, u'coin': u'59d21e9b83a0523906a45db0', u'description': u'', u'title': u'Litecoin to enhance Privacy while Regulators consider the techs’ “Top Threats”', u'url': u'https://cryptocontrol.io/r/api/reddit/5f7c4f177986c600175fe2cf?ref=5f963694c3be7e001761fc25', u'downvotes': 0, u'comments': 0, u'subreddit': u'litecoin', u'activityHotness': 0.69314718056, u'score': 1, u'publishedAt': u'2020-10-06T10:56:38.000Z', u'__v': 0, u'updatedAt': u'2020-10-06T15:43:50.096Z', u'upvotes': 2, u'_id': u'5f7c4f177986c600175fe2cf', u'id': u'j62zdb', u'createdAt': u'2020-10-06T11:03:51.660Z'}",,reddit
5,,"{u'isSelf': True, u'hotness': 74162.617867, u'coin': u'59d21e9b83a0523906a45db0', u'description': u'Would be great if it allows LTC investment in bankroll.', u'title': u'Anyone aware of any provably fair on chain gambling game on Litecoin Blockchain?', u'url': u'https://cryptocontrol.io/r/api/reddit/5f7c4a6b7986c600175faf29?ref=5f963694c3be7e001761fc25', u'downvotes': 0, u'comments': 1, u'subreddit': u'litecoin', u'activityHotness': 1.8718021769, u'score': 1, u'publishedAt': u'2020-10-06T10:28:35.000Z', u'__v': 0, u'updatedAt': u'2020-10-06T16:18:51.653Z', u'upvotes': 5, u'_id': u'5f7c4a6b7986c600175faf29', u'id': u'j62ob2', u'createdAt': u'2020-10-06T10:43:55.942Z'}",,reddit
6,"{u'_id': u'5f7c4861ab4a9e0017b2af11', u'description': u'Litecoin has relaunched its MimbleWimble testnet, a protocol designed to enhance privacy and obfuscate distributed ledger transactions’ traceability. MimbleWimble is a modified implementation of the proof-of-work algorithm underpinning Bitcoin in which blocks appear as a single large transaction,…', u'title': u'Litecoin relaunches its MimbleWimble testnet to enhance privacy.', u'url': u'https://cryptocontrol.io/r/api/article/5f7c4861ab4a9e0017b2af11?ref=5f963694c3be7e001761fc25', u'similarArticles': [{u'title': u'Litecoin Relaunches MimbleWimble Testnet As Regulators Focus on Privacy Cryptocurrencies', u'url': u'https://cryptocontrol.io/r/api/article/5f7c224757b7dd001c5b70e3?ref=5f963694c3be7e001761fc25', u'publishedAt': u'2020-10-06T06:45:25.000Z', u'sourceDomain': u'usethebitcoin.com', u'_id': u'5f7c224757b7dd001c5b70e3', u'thumbnail': u'https://cloudfront.cryptocontrol.io/thumbnails/5f7c224757b7dd001c5b70e3-1601970760066.jpg'}, {u'title': u'Litecoin relaunches MimbleWimble testnet as Europol targets privacy protocols', u'url': u'https://cryptocontrol.io/r/api/article/5f7c0b3d4bce540017293a87?ref=5f963694c3be7e001761fc25', u'publishedAt': u'2020-10-06T05:48:52.000Z', u'sourceDomain': u'cointelegraph.com', u'_id': u'5f7c0b3d4bce540017293a87', u'thumbnail': u'https://cloudfront.cryptocontrol.io/thumbnails/5f7c0b3d4bce540017293a87-1601964861466.jpg'}], u'coins': [{u'tradingSymbol': u'LTC', u'_id': u'59d21e9b83a0523906a45db0', u'name': u'Litecoin', u'slug': u'litecoin'}, {u'tradingSymbol': u'XMR', u'_id': u'59d21e9b83a0523906a45db5', u'name': u'Monero', u'slug': u'monero'}, {u'tradingSymbol': u'BTC', u'_id': u'59cb59e81c073f09e76f614b', u'name': u'Bitcoin', u'slug': u'bitcoin'}, {u'tradingSymbol': u'ZEC', u'_id': u'59d21e9b83a0523906a45dbb', u'name': u'Zcash', u'slug': u'zcash'}, {u'tradingSymbol': u'TOP', u'_id': u'5e3844aa16c3760019f74f7b', u'name': u'TOP', u'slug': u'top'}, {u'tradingSymbol': u'NET', u'_id': u'5cd36d8270d74700100891ad', u'name': u'NEXT', u'slug': u'next'}], u'publishedAt': u'2020-10-06T10:00:43.000Z', u'thumbnail': u'https://cloudfront.cryptocontrol.io/thumbnails/5f7c4861ab4a9e0017b2af11-1601980517886.jpg', u'source': {u'url': u'https://coinnounce.com/', u'_id': u'5d3acea9e19efe001b8c2121', u'name': u'Coinnounce', u'favicon': u'https://assets.cryptocontrol.io/favicons/5d3acea9e19efe001b8c2121.png'}, u'activityHotness': 3.35832425505, u'words': 347, u'sourceDomain': u'coinnounce.com', u'hotness': 74169.0269817, u'primaryCategory': u'General', u'originalImageUrl': u'https://mk0coinnouncemdktlrl.kinstacdn.com/wp-content/uploads/2020/01/1_MoJ3z86gdLMoIFzHvHTkCQ.jpg'}",,,article
7,"{u'_id': u'5f7c20d657b7dd001c5b604f', u'description': u'John McAfee has been arrested and indicted for tax evasion, the U.S. Department of Justice announced. The cybersecurity entrepreneur has also been charged with fraudulently pumping cryptocurrencies by the U.S. Securities and Exchange Commission. McAfee Fraudulently Pumped Tokens The U.S. Department…', u'title': u'John McAfee Arrested, Indicted for $23 Million Illegal Crypto Pumping and Tax Evasion in US', u'url': u'https://cryptocontrol.io/r/api/article/5f7c20d657b7dd001c5b604f?ref=5f963694c3be7e001761fc25', u'similarArticles': [], u'coins': [{u'tradingSymbol': u'BTC', u'_id': u'59cb59e81c073f09e76f614b', u'name': u'Bitcoin', u'slug': u'bitcoin'}, {u'tradingSymbol': u'xrp', u'_id': u'59cb5a047ab17a0b2ec00edf', u'name': u'Ripple', u'slug': u'ripple'}, {u'tradingSymbol': u'BCH', u'_id': u'59d21e9b83a0523906a45daf', u'name': u'Bitcoin Cash', u'slug': u'bitcoin-cash'}, {u'tradingSymbol': u'LTC', u'_id': u'59d21e9b83a0523906a45db0', u'name': u'Litecoin', u'slug': u'litecoin'}, {u'tradingSymbol': u'CS', u'_id': u'5a9b3705a8134644d04a5d85', u'name': u'Credits', u'slug': u'credits'}, {u'tradingSymbol': u'DEFI', u'_id': u'5e3844a816c3760019f74b72', u'name': u'Defi', u'slug': u'defi'}, {u'tradingSymbol': u'BLT', u'_id': u'5a7b930b02ac032bc9978197', u'name': u'Bloom', u'slug': u'bloomtoken'}, {u'tradingSymbol': u'DEX', u'_id': u'5be61f883c4bad00168c1da8', u'name': u'DEX', u'slug': u'dex'}, {u'tradingSymbol': u'DTA', u'_id': u'5a7b931102ac032bc99781f1', u'name': u'DATA', u'slug': u'data'}, {u'tradingSymbol': u'XMR', u'_id': u'59d21e9b83a0523906a45db5', u'name': u'Monero', u'slug': u'monero'}, {u'tradingSymbol': u'ETH', u'_id': u'59cb59f9b0836b0a63aebc7c', u'name': u'Ethereum', u'slug': u'ethereum'}, {u'tradingSymbol': u'TOP', u'_id': u'5e3844aa16c3760019f74f7b', u'name': u'TOP', u'slug': u'top'}, {u'tradingSymbol': u'BIT', u'_id': u'59d8e9a849f28d56105674fd', u'name': u'First Bitcoin', u'slug': u'first-bitcoin'}, {u'tradingSymbol': u'READ', u'_id': u'5a7b931502ac032bc997822c', u'name': u'Read', u'slug': u'read'}], u'publishedAt': u'2020-10-06T07:30:38.000Z', u'thumbnail': u'https://cloudfront.cryptocontrol.io/thumbnails/5f7c20d657b7dd001c5b604f-1601970390674.png', u'source': {u'url': u'https://news.bitcoin.com/', u'_id': u'59d71c67ef8bf95cc2ab0147', u'name': u'Bitcoin.com', u'favicon': u'https://assets.cryptocontrol.io/favicons/59d71c67ef8bf95cc2ab0147.png'}, u'activityHotness': 0.393438864331, u'words': 2334, u'sourceDomain': u'news.bitcoin.com', u'hotness': 74165.6451981, u'primaryCategory': u'General', u'originalImageUrl': u'https://news.bitcoin.com/wp-content/uploads/2019/03/mcafee-arrested.png'}",,,article
8,,"{u'isSelf': False, u'hotness': 74160.1345833, u'coin': u'59d21e9b83a0523906a45db0', u'description': u'', u'title': u'Litecoin Relaunches MimbleWimble Testnet As Regulators Focus On Privacy Cryptocurrencies', u'url': u'https://cryptocontrol.io/r/api/reddit/5f7c13514bce54001729881a?ref=5f963694c3be7e001761fc25', u'downvotes': 0, u'comments': 0, u'subreddit': u'litecoin', u'activityHotness': 0, u'score': 1, u'publishedAt': u'2020-10-06T06:48:27.000Z', u'__v': 0, u'updatedAt': u'2020-10-06T06:48:49.207Z', u'upvotes': 1, u'_id': u'5f7c13514bce54001729881a', u'id': u'j60ef5', u'createdAt': u'2020-10-06T06:48:49.207Z'}",,reddit
9,"{u'_id': u'5f7c0bb34bce5400172943e3', u'description': u'Have you been looking for an online gaming platform you can trust with your digital assets and that won’t bother you with cumbersome identification procedures? Wolf.bet is a 100% provably fair gambling casino supporting multiple cryptocurrencies, without KYC and a great lineup of additional…', u'title': u'Wolf.bet Is a Provably Fair Gambling Casino Supporting Multiple Cryptocurrencies', u'url': u'https://cryptocontrol.io/r/api/article/5f7c0bb34bce5400172943e3?ref=5f963694c3be7e001761fc25', u'similarArticles': [], u'coins': [{u'tradingSymbol': u'BTC', u'_id': u'59cb59e81c073f09e76f614b', u'name': u'Bitcoin', u'slug': u'bitcoin'}, {u'tradingSymbol': u'casino', u'_id': u'59d8e9a749f28d561056731d', u'name': u'Casino', u'slug': u'casino'}, {u'tradingSymbol': u'DTA', u'_id': u'5a7b931102ac032bc99781f1', u'name': u'DATA', u'slug': u'data'}, {u'tradingSymbol': u'oio', u'_id': u'5c05c3873c4bad0016c2504d', u'name': u'Online', u'slug': u'online'}, {u'tradingSymbol': u'xrp', u'_id': u'59cb5a047ab17a0b2ec00edf', u'name': u'Ripple', u'slug': u'ripple'}, {u'tradingSymbol': u'BCH', u'_id': u'59d21e9b83a0523906a45daf', u'name': u'Bitcoin Cash', u'slug': u'bitcoin-cash'}, {u'tradingSymbol': u'LTC', u'_id': u'59d21e9b83a0523906a45db0', u'name': u'Litecoin', u'slug': u'litecoin'}, {u'tradingSymbol': u'DEFI', u'_id': u'5e3844a816c3760019f74b72', u'name': u'Defi', u'slug': u'defi'}, {u'tradingSymbol': u'BLT', u'_id': u'5a7b930b02ac032bc9978197', u'name': u'Bloom', u'slug': u'bloomtoken'}, {u'tradingSymbol': u'DEX', u'_id': u'5be61f883c4bad00168c1da8', u'name': u'DEX', u'slug': u'dex'}, {u'tradingSymbol': u'ETH', u'_id': u'59cb59f9b0836b0a63aebc7c', u'name': u'Ethereum', u'slug': u'ethereum'}, {u'tradingSymbol': u'XMR', u'_id': u'59d21e9b83a0523906a45db5', u'name': u'Monero', u'slug': u'monero'}, {u'tradingSymbol': u'BIT', u'_id': u'59d8e9a849f28d56105674fd', u'name': u'First Bitcoin', u'slug': u'first-bitcoin'}, {u'tradingSymbol': u'TOP', u'_id': u'5e3844aa16c3760019f74f7b', u'name': u'TOP', u'slug': u'top'}, {u'tradingSymbol': u'READ', u'_id': u'5a7b931502ac032bc997822c', u'name': u'Read', u'slug': u'read'}], u'publishedAt': u'2020-10-06T06:00:25.000Z', u'thumbnail': u'https://cloudfront.cryptocontrol.io/thumbnails/5f7c0bb34bce5400172943e3-1601964979809.jpg', u'source': {u'url': u'https://news.bitcoin.com/', u'_id': u'59d71c67ef8bf95cc2ab0147', u'name': u'Bitcoin.com', u'favicon': u'https://assets.cryptocontrol.io/favicons/59d71c67ef8bf95cc2ab0147.png'}, u'activityHotness': 0.390471287517, u'words': 1891, u'sourceDomain': u'news.bitcoin.com', u'hotness': 74165.3916287, u'primaryCategory': u'General', u'originalImageUrl': u'https://news.bitcoin.com/wp-content/uploads/2020/09/cup-header.jpg'}",,,article
10,,"{u'isSelf': False, u'hotness': 74159.9993519, u'coin': u'59d21e9b83a0523906a45db0', u'description': u'', u'title': u'Litecoin (LTC) Bringing in the Magic of Confidential Transactions $LTC + #MWEB = Privacy', u'url': u'https://cryptocontrol.io/r/api/reddit/5f7c09f04bce540017292c98?ref=5f963694c3be7e001761fc25', u'downvotes': 0, u'comments': 0, u'subreddit': u'litecoin', u'activityHotness': 0, u'score': 1, u'publishedAt': u'2020-10-06T05:59:46.000Z', u'__v': 0, u'updatedAt': u'2020-10-06T13:48:55.572Z', u'upvotes': 1, u'_id': u'5f7c09f04bce540017292c98', u'id': u'j5zv3p', u'createdAt': u'2020-10-06T06:08:48.771Z'}",,reddit
11,"{u'_id': u'5f7c07795e82580018222bd4', u'description': u'Catch up on the latest crypto market news at The Currency Analytics.
Litecoin Foundation retweeted a statement which stated that the magic of Confidential Transactions is coming to Litecoin. $LTC + #MWEB…
', u'title': u'Litecoin (LTC) Bringing in the Magic of Confidential Transactions $LTC + #MWEB = Privacy', u'url': u'https://cryptocontrol.io/r/api/article/5f7c07795e82580018222bd4?ref=5f963694c3be7e001761fc25', u'similarArticles': [], u'coins': [{u'tradingSymbol': u'LTC', u'_id': u'59d21e9b83a0523906a45db0', u'name': u'Litecoin', u'slug': u'litecoin'}, {u'tradingSymbol': u'BTC', u'_id': u'59cb59e81c073f09e76f614b', u'name': u'Bitcoin', u'slug': u'bitcoin'}], u'publishedAt': u'2020-10-06T05:39:24.000Z', u'thumbnail': u'https://cloudfront.cryptocontrol.io/thumbnails/5f7c07795e82580018222bd4-1601963897473.jpg', u'source': {u'url': u'https://thecurrencyanalytics.com/', u'_id': u'5c509bf423b00e00101f000b', u'name': u'TheCurrencyAnalytics', u'favicon': u'https://assets.cryptocontrol.io/favicons/5c509bf423b00e00101f000b.jpg'}, u'activityHotness': 0.261740608208, u'words': 426, u'sourceDomain': u'thecurrencyanalytics.com', u'hotness': 74165.2045184, u'primaryCategory': u'General', u'originalImageUrl': u'https://cdn.thecurrencyanalytics.com/wp-content/uploads/2020/10/LitecoinLETMweb-300x300.jpg'}",,,article
12,,,"{u'username': u'ltcfoundation', u'retweetCount': 14, u'language': u'en', u'links': [], u'__v': 0, u'favoriteCount': 68, u'hashtags': [u'Litecoin'], u'publishedAt': u'2020-10-06T00:55:56.000Z', u'symbols': [], u'url': u'https://cryptocontrol.io/r/api/tweet/5f7be3086860950017e0bc59?ref=5f963694c3be7e001761fc25', u'activityHotness': 4.8218931695, u'hotness': 74164.9772635, u'isRetweeted': False, u'text': u'This is a visual example of what an opt-in privacy #Litecoin transaction would look like:', u'updatedAt': u'2020-10-06T03:22:48.957Z', u'mentions': [], u'_id': u'5f7be3086860950017e0bc59', u'twitteratiScore': 0, u'id': u'1313281806272212992', u'createdAt': u'2020-10-06T03:22:48.957Z', u'coin': u'59d21e9b83a0523906a45db0'}",tweet
13,,"{u'isSelf': False, u'hotness': 74163.3591548, u'coin': u'59d21e9b83a0523906a45db0', u'description': u'', u'title': u'Litecoin Inches Closer to Greater Privacy With Mimblewimble Testnet', u'url': u'https://cryptocontrol.io/r/api/reddit/5f7bb9467209df0018204282?ref=5f963694c3be7e001761fc25', u'downvotes': 0, u'comments': 10, u'subreddit': u'litecoin', u'activityHotness': 4.31748811354, u'score': 1, u'publishedAt': u'2020-10-06T00:15:00.000Z', u'__v': 0, u'updatedAt': u'2020-10-06T16:18:51.653Z', u'upvotes': 60, u'_id': u'5f7bb9467209df0018204282', u'id': u'j5v359', u'createdAt': u'2020-10-06T00:24:38.166Z'}",,reddit
14,"{u'_id': u'5f7ba8e994dc6d00188f1264', u'description': u'While all eyes might be on the ETh2 testnet, Litecoin has launched one of its own. Charlie Lee, in his quest to add fungibility and greater privacy to Litecoin, has moved the project closer to the implementation of Mimblewimble via extension blocks. The Mimblewimble protocol for confidential…', u'title': u'Litecoin Inches Closer to Greater Privacy With Mimblewimble Testnet', u'url': u'https://cryptocontrol.io/r/api/article/5f7ba8e994dc6d00188f1264?ref=5f963694c3be7e001761fc25', u'similarArticles': [], u'coins': [{u'tradingSymbol': u'LTC', u'_id': u'59d21e9b83a0523906a45db0', u'name': u'Litecoin', u'slug': u'litecoin'}, {u'tradingSymbol': u'BTC', u'_id': u'59cb59e81c073f09e76f614b', u'name': u'Bitcoin', u'slug': u'bitcoin'}, {u'tradingSymbol': u'GRIN', u'_id': u'5d097b02f9eb99001a2f0a6f', u'name': u'Grin', u'slug': u'grin'}], u'publishedAt': u'2020-10-05T23:00:05.000Z', u'thumbnail': u'https://cloudfront.cryptocontrol.io/thumbnails/5f7ba8e994dc6d00188f1264-1601939689464.jpg', u'source': {u'url': u'https://beincrypto.com', u'_id': u'5b964b640c38a70019787e71', u'name': u'BeInCrypto', u'favicon': u'https://assets.cryptocontrol.io/favicons/5b964b640c38a70019787e71.jpg'}, u'activityHotness': 0.267896397508, u'words': 444, u'sourceDomain': u'beincrypto.com', u'hotness': 74164.1014612, u'primaryCategory': u'General', u'originalImageUrl': u'https://s32659.pcdn.co/wp-content/uploads/2019/10/bic_mimblewimble_litecoin.jpg.optimal.jpg'}",,,article
15,,,"{u'username': u'SatoshiLite', u'retweetCount': 32, u'language': u'en', u'links': [u'https://litecoin.com/en/news/litecoin-mimblewimble-september-update-testnet-launches'], u'__v': 0, u'favoriteCount': 0, u'hashtags': [], u'publishedAt': u'2020-10-05T18:42:29.000Z', u'symbols': [], u'url': u'https://cryptocontrol.io/r/api/tweet/5f7b6bb1a856440017593a4f?ref=5f963694c3be7e001761fc25', u'activityHotness': 4.96981329958, u'hotness': 74164.0878226, u'isRetweeted': True, u'text': u'RT @LitecoinDotCom: Litecoin MimbleWimble September Update: Testnet Launches! $ltc

https://t.co/k5aZgOGdUR', u'updatedAt': u'2020-10-05T18:53:37.293Z', u'mentions': [u'LitecoinDotCom'], u'_id': u'5f7b6bb1a856440017593a4f', u'twitteratiScore': 0, u'id': u'1313187825043480576', u'createdAt': u'2020-10-05T18:53:37.293Z', u'coin': u'59d21e9b83a0523906a45db0'}",tweet
