,article,reddit,tweet,type
29,"{u'_id': u'5f79c2223b4aed0017c651d5', u'description': u'Many cryptocurrency platforms have given an additional passive source of income to its users. If you are completely new to blockchain or cryptocurrency and don’t want to risk your hard-earned money, then there are certain platforms from where you can earn crypto and learn the basics of this new…', u'title': u'How to Use StormX - Reviews - Altcoin Buzz', u'url': u'https://cryptocontrol.io/r/api/article/5f79c2223b4aed0017c651d5?ref=5f963694c3be7e001761fc25', u'similarArticles': [], u'coins': [{u'tradingSymbol': u'dai', u'_id': u'5a7b930d02ac032bc99781ba', u'name': u'Dai', u'slug': u'dai'}, {u'tradingSymbol': u'ETH', u'_id': u'59cb59f9b0836b0a63aebc7c', u'name': u'Ethereum', u'slug': u'ethereum'}, {u'tradingSymbol': u'STORM', u'_id': u'5a7b930802ac032bc9978177', u'name': u'Storm', u'slug': u'storm'}, {u'tradingSymbol': u'STMX', u'_id': u'5f2350fda4a36200194a4087', u'name': u'StormX', u'slug': u'stormx'}, {u'tradingSymbol': u'oio', u'_id': u'5c05c3873c4bad0016c2504d', u'name': u'Online', u'slug': u'online'}, {u'tradingSymbol': u'BTC', u'_id': u'59cb59e81c073f09e76f614b', u'name': u'Bitcoin', u'slug': u'bitcoin'}, {u'tradingSymbol': u'LTC', u'_id': u'59d21e9b83a0523906a45db0', u'name': u'Litecoin', u'slug': u'litecoin'}], u'publishedAt': u'2020-10-04T11:42:47.000Z', u'thumbnail': u'https://cloudfront.cryptocontrol.io/thumbnails/5f79c2223b4aed0017c651d5-1601815074776.jpg', u'source': {u'url': u'https://altcoinbuzz.io/', u'_id': u'5c10e3983c4bad0016a0f5fd', u'name': u'Altcoinbuzz', u'favicon': u'https://assets.cryptocontrol.io/favicons/5c10e3983c4bad0016a0f5fd.png'}, u'activityHotness': 0.276814960359, u'words': 688, u'sourceDomain': u'', u'hotness': 74158.2289909, u'primaryCategory': u'Government', u'originalImageUrl': u'https://www.altcoinbuzz.io/wp-content/uploads/2020/09/Altcoinbuzz-1200x-630-3.jpg'}",,,article
30,"{u'_id': u'5f79afb19d5f44001aa97298', u'description': u'BNB takes the 5th spot, while Litecoin is back at the top 10. Bitcoin and the other larger-cap altcoins have stayed stagnant, but the US stock futures could drive volatile price performances later today.
', u'title': u'Binance Coin (BNB) Back To Top 5 After 9% Weekly Gains: Bitcoin Price Stagnant (Sunday’s Market Watch)', u'url': u'https://cryptocontrol.io/r/api/article/5f79afb19d5f44001aa97298?ref=5f963694c3be7e001761fc25', u'similarArticles': [], u'coins': [{u'tradingSymbol': u'LTC', u'_id': u'59d21e9b83a0523906a45db0', u'name': u'Litecoin', u'slug': u'litecoin'}, {u'tradingSymbol': u'BNB', u'_id': u'59d21e9b83a0523906a45dd4', u'name': u'Binance Coin', u'slug': u'binance-coin'}, {u'tradingSymbol': u'mcr', u'_id': u'5a1aafdbda3d21115462ee98', u'name': u'Macro', u'slug': u'macro1'}, {u'tradingSymbol': u'MIDAS', u'_id': u'5e3844a916c3760019f74cc3', u'name': u'Midas', u'slug': u'midas'}, {u'tradingSymbol': u'EWT', u'_id': u'5f2350fca4a36200194a405b', u'name': u'Energy Web Token', u'slug': u'energy-web-token'}, {u'tradingSymbol': u'ETH', u'_id': u'59cb59f9b0836b0a63aebc7c', u'name': u'Ethereum', u'slug': u'ethereum'}, {u'tradingSymbol': u'gnr', u'_id': u'5b9afa060c38a7001913a55b', u'name': u'Gainer', u'slug': u'gainer'}, {u'tradingSymbol': u'CHX', u'_id': u'5b7ca78b0c38a700190ebdff', u'name': u'Own', u'slug': u'own'}, {u'tradingSymbol': u'xrp', u'_id': u'59cb5a047ab17a0b2ec00edf', u'name': u'Ripple', u'slug': u'ripple'}], u'publishedAt': u'2020-10-04T08:56:17.000Z', u'thumbnail': u'https://cloudfront.cryptocontrol.io/thumbnails/5f79afb19d5f44001aa97298-1601810353963.jpg', u'source': {u'url': u'https://cryptopotato.com/', u'_id': u'5ce406880175730010f47558', u'name': u'Crypto Potato', u'favicon': u'https://assets.cryptocontrol.io/favicons/5ce406880175730010f47558.png'}, u'activityHotness': 0.321484617869, u'words': 286, u'sourceDomain': u'cryptopotato.com', u'hotness': 74157.8111605, u'primaryCategory': u'Analysis', u'originalImageUrl': u'https://cryptopotato.com/wp-content/uploads/2020/10/bnb_bitcoin_cover.jpg'}",,,article
31,"{u'_id': u'5f791c69ce5a6a0019aa6413', u'description': u'Over a half a million dollars worth of bitcoin from a May 2010 coinbase reward was transferred to Bitfinex on October 1. A parser recorded the old coins being spent and since mid-February 2020, roughly 33 so-called ‘sleeping bitcoin addresses’ from ten years ago have been spent to-date.…', u'title': u'$8M Worth of ‘Sleeping’ Bitcoin Rewards from 2010 Moved the Day Before ‘Black Thursday’', u'url': u'https://cryptocontrol.io/r/api/article/5f791c69ce5a6a0019aa6413?ref=5f963694c3be7e001761fc25', u'similarArticles': [], u'coins': [{u'tradingSymbol': u'BTC', u'_id': u'59cb59e81c073f09e76f614b', u'name': u'Bitcoin', u'slug': u'bitcoin'}, {u'tradingSymbol': u'xrp', u'_id': u'59cb5a047ab17a0b2ec00edf', u'name': u'Ripple', u'slug': u'ripple'}, {u'tradingSymbol': u'BCH', u'_id': u'59d21e9b83a0523906a45daf', u'name': u'Bitcoin Cash', u'slug': u'bitcoin-cash'}, {u'tradingSymbol': u'LTC', u'_id': u'59d21e9b83a0523906a45db0', u'name': u'Litecoin', u'slug': u'litecoin'}, {u'tradingSymbol': u'CS', u'_id': u'5a9b3705a8134644d04a5d85', u'name': u'Credits', u'slug': u'credits'}, {u'tradingSymbol': u'DEFI', u'_id': u'5e3844a816c3760019f74b72', u'name': u'Defi', u'slug': u'defi'}, {u'tradingSymbol': u'ETH', u'_id': u'59cb59f9b0836b0a63aebc7c', u'name': u'Ethereum', u'slug': u'ethereum'}, {u'tradingSymbol': u'DTA', u'_id': u'5a7b931102ac032bc99781f1', u'name': u'DATA', u'slug': u'data'}, {u'tradingSymbol': u'DEX', u'_id': u'5be61f883c4bad00168c1da8', u'name': u'DEX', u'slug': u'dex'}, {u'tradingSymbol': u'NET', u'_id': u'5cd36d8270d74700100891ad', u'name': u'NEXT', u'slug': u'next'}, {u'tradingSymbol': u'ERC20', u'_id': u'5a1aafdbda3d21115462eead', u'name': u'ERC20', u'slug': u'erc20'}, {u'tradingSymbol': u'TOP', u'_id': u'5e3844aa16c3760019f74f7b', u'name': u'TOP', u'slug': u'top'}, {u'tradingSymbol': u'BIT', u'_id': u'59d8e9a849f28d56105674fd', u'name': u'First Bitcoin', u'slug': u'first-bitcoin'}], u'publishedAt': u'2020-10-04T00:30:22.000Z', u'thumbnail': u'https://cloudfront.cryptocontrol.io/thumbnails/5f791c69ce5a6a0019aa6413-1601772650054.jpg', u'source': {u'url': u'https://news.bitcoin.com/', u'_id': u'59d71c67ef8bf95cc2ab0147', u'name': u'Bitcoin.com', u'favicon': u'https://assets.cryptocontrol.io/favicons/59d71c67ef8bf95cc2ab0147.png'}, u'activityHotness': 0.358324255051, u'words': 2201, u'sourceDomain': u'news.bitcoin.com', u'hotness': 74156.4426761, u'primaryCategory': u'General', u'originalImageUrl': u'https://news.bitcoin.com/wp-content/uploads/2020/10/7-9m-worth-of-sleeping-bitcoin-rewards-from-2010-moved-the-day-before-black-thursday.jpg'}",,,article
32,"{u'_id': u'5f78f260ce5a6a0019a8db34', u'description': u'LTC Price Prediction – October 3 Litecoin sees a 2% price increase over the past 24 hours of trading as the cryptocurrency reaches $46. LTC/USD [...]
', u'title': u'Litecoin Price Prediction: LTC/USD Rebounds as It Sets Sight to $50 Resistance Level', u'url': u'https://cryptocontrol.io/r/api/article/5f78f260ce5a6a0019a8db34?ref=5f963694c3be7e001761fc25', u'similarArticles': [], u'coins': [{u'tradingSymbol': u'LTC', u'_id': u'59d21e9b83a0523906a45db0', u'name': u'Litecoin', u'slug': u'litecoin'}, {u'tradingSymbol': u'TOP', u'_id': u'5e3844aa16c3760019f74f7b', u'name': u'TOP', u'slug': u'top'}, {u'tradingSymbol': u'NET', u'_id': u'5cd36d8270d74700100891ad', u'name': u'NEXT', u'slug': u'next'}, {u'tradingSymbol': u'BTC', u'_id': u'59cb59e81c073f09e76f614b', u'name': u'Bitcoin', u'slug': u'bitcoin'}], u'publishedAt': u'2020-10-03T21:43:41.000Z', u'thumbnail': u'https://cloudfront.cryptocontrol.io/thumbnails/5f78f260ce5a6a0019a8db34-1601761888683.png', u'source': {u'url': u'https://insidebitcoins.com/', u'_id': u'5ccabcb670d7470010854415', u'name': u'InsideBitcoins', u'favicon': u'https://assets.cryptocontrol.io/favicons/5ccabcb670d7470010854415.png'}, u'activityHotness': 0.274919985481, u'words': 340, u'sourceDomain': u'insidebitcoins.com', u'hotness': 74155.8962626, u'primaryCategory': u'Analysis', u'originalImageUrl': u'https://cdn.insidebitcoins.com/wp-content/uploads/2020/10/LTCUSD_03102020.png'}",,,article
33,"{u'_id': u'5f78ad052a692e0017d61fc1', u'description': u'Catch up on the latest crypto market news at The Currency Analytics.
Swap Space have expressed their support for DGB, thus making it easy to provide smooth and secure DGB swaps. DGB…
', u'title': u'Digibyte (DGB) Making Things Better For Everyone in the Long Run in the Blockchain Space', u'url': u'https://cryptocontrol.io/r/api/article/5f78ad052a692e0017d61fc1?ref=5f963694c3be7e001761fc25', u'similarArticles': [], u'coins': [{u'tradingSymbol': u'BTC', u'_id': u'59cb59e81c073f09e76f614b', u'name': u'Bitcoin', u'slug': u'bitcoin'}, {u'tradingSymbol': u'ETH', u'_id': u'59cb59f9b0836b0a63aebc7c', u'name': u'Ethereum', u'slug': u'ethereum'}, {u'tradingSymbol': u'LTC', u'_id': u'59d21e9b83a0523906a45db0', u'name': u'Litecoin', u'slug': u'litecoin'}, {u'tradingSymbol': u'DGB', u'_id': u'59d21e9b83a0523906a45ddb', u'name': u'DigiByte', u'slug': u'digibyte'}, {u'tradingSymbol': u'rcd', u'_id': u'5b4be006c831fd000fc41c2d', u'name': u'Record', u'slug': u'record'}, {u'tradingSymbol': u'XWP', u'_id': u'5e3844a916c3760019f74d25', u'name': u'Swap', u'slug': u'swap'}], u'publishedAt': u'2020-10-03T16:12:37.000Z', u'thumbnail': u'https://cloudfront.cryptocontrol.io/thumbnails/5f78ad052a692e0017d61fc1-1601744133270.jpg', u'source': {u'url': u'https://thecurrencyanalytics.com/', u'_id': u'5c509bf423b00e00101f000b', u'name': u'TheCurrencyAnalytics', u'favicon': u'https://assets.cryptocontrol.io/favicons/5c509bf423b00e00101f000b.jpg'}, u'activityHotness': 0.276301700036, u'words': 454, u'sourceDomain': u'thecurrencyanalytics.com', u'hotness': 74154.9780147, u'primaryCategory': u'Blockchain', u'originalImageUrl': u'https://cdn.thecurrencyanalytics.com/wp-content/uploads/2020/10/DigibyteDGBblockchain-300x300.jpg'}",,,article
34,"{u'_id': u'5f7876eb1b265a0017b68224', u'description': u'Bitcoin faucets give users an opportunity to get free Bitcoins. Some of them require users to carry out a few simple tasks to earn Bitcoin as rewards; the activities can be fun and easy enough for anyone to engage in and get some Bitcoins without having to buy with money, which is the main idea […]
', u'title': u'These Are the Most Rewarding Bitcoin Faucets in October 2020', u'url': u'https://cryptocontrol.io/r/api/article/5f7876eb1b265a0017b68224?ref=5f963694c3be7e001761fc25', u'similarArticles': [], u'coins': [{u'tradingSymbol': u'BTC', u'_id': u'59cb59e81c073f09e76f614b', u'name': u'Bitcoin', u'slug': u'bitcoin'}, {u'tradingSymbol': u'LTC', u'_id': u'59d21e9b83a0523906a45db0', u'name': u'Litecoin', u'slug': u'litecoin'}], u'publishedAt': u'2020-10-03T13:00:00.000Z', u'thumbnail': u'https://cloudfront.cryptocontrol.io/thumbnails/5f7876eb1b265a0017b68224-1601730283783.jpg', u'source': {u'url': u'https://coindoo.com', u'_id': u'5af1c9d401aed341ae236047', u'name': u'CoinDoo', u'favicon': u'https://assets.cryptocontrol.io/favicons/5af1c9d401aed341ae236047.png'}, u'activityHotness': 0.268268837417, u'words': 834, u'sourceDomain': u'coindoo.com', u'hotness': 74154.4349355, u'primaryCategory': u'General', u'originalImageUrl': u'https://coindoo.com/wp-content/uploads/2020/10/bitcoin-faucets.jpg'}",,,article
35,"{u'_id': u'5f7884b6ca0cc40017aec802', u'description': u'KuCoin hacker had used not decentralized exchange for laundering stolen funds but had also utilized centralized exchange for the purpose. According to Chainalysis, almost $9 million of stolen funds have moved over centralized exchanges. $13 Million via Decentralized Exchanges The hacking incident…', u'title': u'KuCoin Hacker Sent over $9 Million to Centralized Exchanges to Buy...', u'url': u'https://cryptocontrol.io/r/api/article/5f7884b6ca0cc40017aec802?ref=5f963694c3be7e001761fc25', u'similarArticles': [{u'title': u'KuCoin Thief Swapped LTC for Bitcoin on CEX: Chainalysis', u'url': u'https://cryptocontrol.io/r/api/article/5f77d2f09c45460018a6aa0f?ref=5f963694c3be7e001761fc25', u'publishedAt': u'2020-10-03T01:03:14.000Z', u'sourceDomain': u'decrypt.co', u'_id': u'5f77d2f09c45460018a6aa0f', u'thumbnail': u'https://cloudfront.cryptocontrol.io/thumbnails/5f77d2f09c45460018a6aa0f-1601688304653.jpg'}], u'coins': [{u'tradingSymbol': u'BTC', u'_id': u'59cb59e81c073f09e76f614b', u'name': u'Bitcoin', u'slug': u'bitcoin'}, {u'tradingSymbol': u'ETH', u'_id': u'59cb59f9b0836b0a63aebc7c', u'name': u'Ethereum', u'slug': u'ethereum'}, {u'tradingSymbol': u'LTC', u'_id': u'59d21e9b83a0523906a45db0', u'name': u'Litecoin', u'slug': u'litecoin'}, {u'tradingSymbol': u'XRP', u'_id': u'5de5a582d37160001ab4bdff', u'name': u'XRP', u'slug': u'xrp'}, {u'tradingSymbol': u'TOP', u'_id': u'5e3844aa16c3760019f74f7b', u'name': u'TOP', u'slug': u'top'}, {u'tradingSymbol': u'USDT', u'_id': u'59d21e9b83a0523906a45dbe', u'name': u'Tether', u'slug': u'tether'}], u'publishedAt': u'2020-10-03T12:41:07.000Z', u'thumbnail': u'https://cloudfront.cryptocontrol.io/thumbnails/5f7884b6ca0cc40017aec802-1601733816713.jpg', u'source': {u'url': u'https://tokenhell.com/', u'_id': u'5d79ee2e26ceed001aa0514b', u'name': u'Tokenhell', u'favicon': u'https://assets.cryptocontrol.io/favicons/5d79ee2e26ceed001aa0514b.png'}, u'activityHotness': 1.83035845933, u'words': 351, u'sourceDomain': u'tokenhell.com', u'hotness': 74155.9445714, u'primaryCategory': u'Exchanges', u'originalImageUrl': u'https://tokenhell.com/wp-content/uploads/hacker-5332676_1920.jpg'}",,,article
36,,"{u'isSelf': True, u'hotness': 74153.2146261, u'coin': u'59d21e9b83a0523906a45db0', u'description': u'Hi guys, newbie here, I was wondering why litecoin is so mistreated by Bitcoin owners and other cryptocurrency enthusiasts. Maybe someone can help me understand better why', u'title': u'Litecoin mistreated', u'url': u'https://cryptocontrol.io/r/api/reddit/5f7875701b265a0017b66afa?ref=5f963694c3be7e001761fc25', u'downvotes': 0, u'comments': 34, u'subreddit': u'litecoin', u'activityHotness': 4.29045944115, u'score': 1, u'publishedAt': u'2020-10-03T11:32:42.000Z', u'__v': 0, u'updatedAt': u'2020-10-06T16:18:51.653Z', u'upvotes': 22, u'_id': u'5f7875701b265a0017b66afa', u'id': u'j4e9ky', u'createdAt': u'2020-10-03T12:58:24.376Z'}",,reddit
37,"{u'_id': u'5f785448615f8f00174d119d', u'description': u'In the last week of crypto September, KuCoin got hacked, along the way exposing a key difference between bitcoin and altcoins. Cardano was the best performer while Litecoin dropped out of top 10. OpenBazaar got temporarily saved from becoming ClosedBazaar by an anonymous donor, Bithumb won a legal…', u'title': u'Hackation, Salvation, Expansion, and 20 Crypto Jokes', u'url': u'https://cryptocontrol.io/r/api/article/5f785448615f8f00174d119d?ref=5f963694c3be7e001761fc25', u'similarArticles': [], u'coins': [{u'tradingSymbol': u'BTC', u'_id': u'59cb59e81c073f09e76f614b', u'name': u'Bitcoin', u'slug': u'bitcoin'}, {u'tradingSymbol': u'key', u'_id': u'5afcc60ced3b0e000f40d55c', u'name': u'KEY', u'slug': u'key'}, {u'tradingSymbol': u'DEFI', u'_id': u'5e3844a816c3760019f74b72', u'name': u'Defi', u'slug': u'defi'}, {u'tradingSymbol': u'LTC', u'_id': u'59d21e9b83a0523906a45db0', u'name': u'Litecoin', u'slug': u'litecoin'}], u'publishedAt': u'2020-10-03T10:00:00.000Z', u'thumbnail': u'https://cloudfront.cryptocontrol.io/thumbnails/5f785448615f8f00174d119d-1601721416111.jpg', u'source': {u'url': u'https://cryptonews.com/', u'_id': u'5c8fbb44a4410000111f614b', u'name': u'CryptoNews', u'favicon': u'https://assets.cryptocontrol.io/favicons/5c8fbb44a4410000111f614b.png'}, u'activityHotness': 0.261938824329, u'words': 191, u'sourceDomain': u'cryptonews.com', u'hotness': 74153.9286055, u'primaryCategory': u'General', u'originalImageUrl': u'https://cimg.co/w/articles/0/5f7/8240520bd6.jpg'}",,,article
38,"{u'_id': u'5f784fd270262f001788f24e', u'description': u'The mainstream adoption of digital assets has been one of the most important goals that the crypto industry has set. There have been a lot of moves made that support the achievement of this important goal, and they continued this year as well, despite the global crisis in the middle of which we are…', u'title': u'Number Of Crypto Users Worldwide Breaks 100 Million', u'url': u'https://cryptocontrol.io/r/api/article/5f784fd270262f001788f24e?ref=5f963694c3be7e001761fc25', u'similarArticles': [], u'coins': [{u'tradingSymbol': u'BTC', u'_id': u'59cb59e81c073f09e76f614b', u'name': u'Bitcoin', u'slug': u'bitcoin'}, {u'tradingSymbol': u'BCH', u'_id': u'59d21e9b83a0523906a45daf', u'name': u'Bitcoin Cash', u'slug': u'bitcoin-cash'}, {u'tradingSymbol': u'LTC', u'_id': u'59d21e9b83a0523906a45db0', u'name': u'Litecoin', u'slug': u'litecoin'}, {u'tradingSymbol': u'oio', u'_id': u'5c05c3873c4bad0016c2504d', u'name': u'Online', u'slug': u'online'}], u'publishedAt': u'2020-10-03T08:49:08.000Z', u'thumbnail': u'https://cloudfront.cryptocontrol.io/thumbnails/5f784fd270262f001788f24e-1601720274468.jpg', u'source': {u'url': u'https://oracletimes.com/', u'_id': u'5bac83ff0c38a70019d8ffd9', u'name': u'Oracle Times', u'favicon': u'https://assets.cryptocontrol.io/favicons/5bac83ff0c38a70019d8ffd9.png'}, u'activityHotness': 0.318267479632, u'words': 318, u'sourceDomain': u'', u'hotness': 74153.7880823, u'primaryCategory': u'Exchanges', u'originalImageUrl': u'https://cryptogazette.com/adminlogin/uploads/2020/10/New-KYC-rules-will-reduce-anonymity-for-Crypto-users.jpg'}",,,article
39,,"{u'isSelf': False, u'hotness': 74150.0704879, u'coin': u'59d21e9b83a0523906a45db0', u'description': u'', u'title': u'An Inside Look At Wyoming State Regulators Prepping For First Crypto Bank Examinations', u'url': u'https://cryptocontrol.io/r/api/reddit/5f77f7ecde2b71001973a9ce?ref=5f963694c3be7e001761fc25', u'downvotes': 0, u'comments': 0, u'subreddit': u'litecoin', u'activityHotness': 2.3978952728, u'score': 1, u'publishedAt': u'2020-10-03T04:02:08.000Z', u'__v': 0, u'updatedAt': u'2020-10-06T16:18:51.653Z', u'upvotes': 11, u'_id': u'5f77f7ecde2b71001973a9ce', u'id': u'j497y5', u'createdAt': u'2020-10-03T04:02:52.676Z'}",,reddit
40,,,"{u'username': u'SatoshiLite', u'retweetCount': 942, u'language': u'en', u'links': [], u'__v': 0, u'favoriteCount': 0, u'hashtags': [], u'publishedAt': u'2020-10-02T23:25:00.000Z', u'symbols': [], u'url': u'https://cryptocontrol.io/r/api/tweet/5f77e927de2b710019730ce1?ref=5f963694c3be7e001761fc25', u'activityHotness': 8.35208267135, u'hotness': 74156.2548604, u'isRetweeted': True, u'text': u'RT @MIT_CSAIL: Stay at 127.0.0.1
Wear a 255.0.0.0', u'updatedAt': u'2020-10-03T02:59:52.053Z', u'mentions': [u'MIT_CSAIL'], u'_id': u'5f77e927de2b710019730ce1', u'twitteratiScore': 0, u'id': u'1312171757264990208', u'createdAt': u'2020-10-03T02:59:52.053Z', u'coin': u'59d21e9b83a0523906a45db0'}",tweet
41,,"{u'isSelf': False, u'hotness': 74151.3871549, u'coin': u'59d21e9b83a0523906a45db0', u'description': u'', u'title': u'Litecoin Privacy Upgrade Launches Testnet, Mainnet Slated for 2021', u'url': u'https://cryptocontrol.io/r/api/reddit/5f77b76ea0cf910018479720?ref=5f963694c3be7e001761fc25', u'downvotes': 0, u'comments': 24, u'subreddit': u'litecoin', u'activityHotness': 4.48863636973, u'score': 2, u'publishedAt': u'2020-10-02T23:23:28.000Z', u'__v': 0, u'updatedAt': u'2020-10-06T16:18:51.653Z', u'upvotes': 53, u'_id': u'5f77b76ea0cf910018479720', u'id': u'j459h5', u'createdAt': u'2020-10-02T23:27:42.588Z'}",,reddit
42,"{u'_id': u'5f77947b6e30220019feb58c', u'description': u'The end of the U.S. federal government's fiscal year brought a cascade of major announcements from agencies.
Every Friday, Law Decoded delivers analysis on the week’s critical stories in the realms of policy, regulation and law.
Editor's note
In a tweet late last night, President Trump said that he…', u'title': u'Law Decoded: The year of the Crypto Futures Trading Commission, Sept. 25–Oct. 2', u'url': u'https://cryptocontrol.io/r/api/article/5f77947b6e30220019feb58c?ref=5f963694c3be7e001761fc25', u'similarArticles': [{u'title': u'Trending Bitcoin News and Market Sentiment, Weekly Edition, 2nd October, 2020: US Regulators Win String of Victories, Bitcoin’s Longest Stay Above $10,000', u'url': u'https://cryptocontrol.io/r/api/article/5f77527593b0a1001724e062?ref=5f963694c3be7e001761fc25', u'publishedAt': u'2020-10-02T16:08:17.000Z', u'sourceDomain': u'bitcoinnews.com', u'_id': u'5f77527593b0a1001724e062', u'thumbnail': u'https://cloudfront.cryptocontrol.io/thumbnails/5f77527593b0a1001724e062-1601655413185.jpg'}], u'coins': [{u'tradingSymbol': u'pres', u'_id': u'59d8e9a749f28d5610567499', u'name': u'President Trump', u'slug': u'president-trump'}, {u'tradingSymbol': u'BTC', u'_id': u'59cb59e81c073f09e76f614b', u'name': u'Bitcoin', u'slug': u'bitcoin'}, {u'tradingSymbol': u'LTC', u'_id': u'59d21e9b83a0523906a45db0', u'name': u'Litecoin', u'slug': u'litecoin'}], u'publishedAt': u'2020-10-02T19:58:00.000Z', u'thumbnail': u'https://cloudfront.cryptocontrol.io/thumbnails/5f77947b6e30220019feb58c-1601672318355.jpg', u'source': {u'url': u'https://cointelegraph.com/', u'_id': u'59d70be3ef8bf95cc2aa2b4f', u'name': u'CoinTelegraph', u'favicon': u'https://assets.cryptocontrol.io/favicons/59d70be3ef8bf95cc2aa2b4f.png'}, u'activityHotness': 1.76311994042, u'words': 1053, u'sourceDomain': u'cointelegraph.com', u'hotness': 74153.0908977, u'primaryCategory': u'Exchanges', u'originalImageUrl': u'https://images.cointelegraph.com/images/740_aHR0cHM6Ly9zMy5ldS1jZW50cmFsLTEuYW1hem9uYXdzLmNvbS9zMy5jb2ludGVsZWdyYXBoLmNvbS91cGxvYWRzLzIwMjAtMTAvMGI0ZmExYzItN2QwMi00MmJiLTgyZmItYTZhMDk2Zjc3YjJiLmpwZw==.jpg'}",,,article
43,"{u'_id': u'5f778ce330469e00191ec77b', u'description': u'This guide will update weekly/monthly so keep tuned! What is LiteBringer? From the German developer Cipsoft (makers of the Massive Multiplayer Online Role-Playing Game (MMORPG) Tibia), LiteBringer is the first game created to run on the Litecoin (LTC) blockchain. Officially released on the 4th of…', u'title': u'LiteBringer: the #1 guide for beginners and veterans', u'url': u'https://cryptocontrol.io/r/api/article/5f778ce330469e00191ec77b?ref=5f963694c3be7e001761fc25', u'similarArticles': [], u'coins': [{u'tradingSymbol': u'LTC', u'_id': u'59d21e9b83a0523906a45db0', u'name': u'Litecoin', u'slug': u'litecoin'}, {u'tradingSymbol': u'BTC', u'_id': u'59cb59e81c073f09e76f614b', u'name': u'Bitcoin', u'slug': u'bitcoin'}, {u'tradingSymbol': u'NET', u'_id': u'5cd36d8270d74700100891ad', u'name': u'NEXT', u'slug': u'next'}, {u'tradingSymbol': u'XLM', u'_id': u'59d21e9b83a0523906a45dcb', u'name': u'Stellar Lumens', u'slug': u'stellar'}, {u'tradingSymbol': u'oio', u'_id': u'5c05c3873c4bad0016c2504d', u'name': u'Online', u'slug': u'online'}], u'publishedAt': u'2020-10-02T19:20:38.000Z', u'thumbnail': u'https://cloudfront.cryptocontrol.io/thumbnails/5f778ce330469e00191ec77b-1601670371574.png', u'source': {u'url': u'https://www.cryptopolitan.com/', u'_id': u'5bda96120c38a7001984d502', u'name': u'Cryptopolitan', u'favicon': u'https://assets.cryptocontrol.io/favicons/5bda96120c38a7001984d502.png'}, u'activityHotness': 0.322570404866, u'words': 1150, u'sourceDomain': u'cryptopolitan.com', u'hotness': 74151.5465519, u'primaryCategory': u'General', u'originalImageUrl': u'https://cryptopolitanimg.s3.amazonaws.com/wp-content/uploads/2020/10/02185133/LiteBringer_CharacterLineUp2-removebg-preview.png'}",,,article
