,article,reddit,tweet,type
78,,,"{u'username': u'ltcfoundation', u'retweetCount': 0, u'language': u'en', u'links': [u'https://twitter.com/DavidBurkett38/status/1311335617264062464'], u'__v': 0, u'favoriteCount': 1, u'hashtags': [u'Litecoin', u'MWEB', u'fungibility'], u'publishedAt': u'2020-09-30T16:07:29.000Z', u'symbols': [], u'url': u'https://cryptocontrol.io/r/api/tweet/5f74ad622cee63001b55e8fe?ref=5f963694c3be7e001761fc25', u'activityHotness': 0, u'hotness': 74138.6874537, u'isRetweeted': False, u'text': u'Hide your kids.
Hide your wife.

#Litecoin #MWEB #fungibility https://t.co/KqFyirosyD', u'updatedAt': u'2020-09-30T16:08:02.694Z', u'mentions': [], u'_id': u'5f74ad622cee63001b55e8fe', u'twitteratiScore': 0, u'id': u'1311336875311984643', u'createdAt': u'2020-09-30T16:08:02.694Z', u'coin': u'59d21e9b83a0523906a45db0'}",tweet
79,,"{u'isSelf': False, u'hotness': 74139.1358367, u'coin': u'59d21e9b83a0523906a45db0', u'description': u'', u'title': u'Blockreward.app is the easiest place to earn Litecoin through simple online tasks.', u'url': u'https://cryptocontrol.io/r/api/reddit/5f74aa9a2cee63001b55d1c6?ref=5f963694c3be7e001761fc25', u'downvotes': 0, u'comments': 3, u'subreddit': u'litecoin', u'activityHotness': 1.50407739678, u'score': 1, u'publishedAt': u'2020-09-30T15:47:26.000Z', u'__v': 0, u'updatedAt': u'2020-10-06T16:18:51.653Z', u'upvotes': 0, u'_id': u'5f74aa9a2cee63001b55d1c6', u'id': u'j2omly', u'createdAt': u'2020-09-30T15:56:10.873Z'}",,reddit
80,,,"{u'username': u'ltcfoundation', u'retweetCount': 3, u'language': u'en', u'links': [], u'__v': 0, u'favoriteCount': 17, u'hashtags': [], u'publishedAt': u'2020-09-30T14:52:55.000Z', u'symbols': [], u'url': u'https://cryptocontrol.io/r/api/tweet/5f749e94fa2f2a001ab58faf?ref=5f963694c3be7e001761fc25', u'activityHotness': 3.36037538714, u'hotness': 74141.8406995, u'isRetweeted': False, u'text': u'Happy mid-autumn festival. To the moon! https://t.co/JwzpBwinnA', u'updatedAt': u'2020-09-30T15:04:53.253Z', u'mentions': [], u'_id': u'5f749e94fa2f2a001ab58faf', u'twitteratiScore': 0, u'id': u'1311318112029929472', u'createdAt': u'2020-09-30T15:04:53.253Z', u'coin': u'59d21e9b83a0523906a45db0'}",tweet
81,,,"{u'username': u'ltcfoundation', u'retweetCount': 4, u'language': u'en', u'links': [u'https://twitter.com/i/web/status/1311308253918359553'], u'__v': 0, u'favoriteCount': 13, u'hashtags': [u'Litecoin'], u'publishedAt': u'2020-09-30T14:13:45.000Z', u'symbols': [], u'url': u'https://cryptocontrol.io/r/api/tweet/5f749354fa2f2a001ab52609?ref=5f963694c3be7e001761fc25', u'activityHotness': 3.39114704581, u'hotness': 74141.7626748, u'isRetweeted': False, u'text': u'This is another great partnership we are excited to put out there to help all #Litecoin users and investors.

Nexo… https://t.co/11irpHsl3o', u'updatedAt': u'2020-09-30T14:16:52.486Z', u'mentions': [], u'_id': u'5f749354fa2f2a001ab52609', u'twitteratiScore': 0, u'id': u'1311308253918359553', u'createdAt': u'2020-09-30T14:16:52.486Z', u'coin': u'59d21e9b83a0523906a45db0'}",tweet
82,"{u'_id': u'5f7478b33e1e660017eef946', u'description': u'JPMorgan Chase has admitted to fraud charges and agreed to settle with the U.S. Department of Justice, the Commodity Futures Trading Commission, and the Securities and Exchange Commission. The firm has agreed to pay nearly a billion dollars in penalties and victim compensation. JPMorgan’s Fraud…', u'title': u'JPMorgan Admits Fraud, Agrees to Billion Dollar Settlement for Illegal Trading', u'url': u'https://cryptocontrol.io/r/api/article/5f7478b33e1e660017eef946?ref=5f963694c3be7e001761fc25', u'similarArticles': [], u'coins': [{u'tradingSymbol': u'BTC', u'_id': u'59cb59e81c073f09e76f614b', u'name': u'Bitcoin', u'slug': u'bitcoin'}, {u'tradingSymbol': u'xrp', u'_id': u'59cb5a047ab17a0b2ec00edf', u'name': u'Ripple', u'slug': u'ripple'}, {u'tradingSymbol': u'BCH', u'_id': u'59d21e9b83a0523906a45daf', u'name': u'Bitcoin Cash', u'slug': u'bitcoin-cash'}, {u'tradingSymbol': u'LTC', u'_id': u'59d21e9b83a0523906a45db0', u'name': u'Litecoin', u'slug': u'litecoin'}, {u'tradingSymbol': u'LINK', u'_id': u'59d21e9b83a0523906a45dda', u'name': u'ChainLink', u'slug': u'chainlink'}, {u'tradingSymbol': u'NET', u'_id': u'5cd36d8270d74700100891ad', u'name': u'NEXT', u'slug': u'next'}, {u'tradingSymbol': u'ERC20', u'_id': u'5a1aafdbda3d21115462eead', u'name': u'ERC20', u'slug': u'erc20'}, {u'tradingSymbol': u'DEFI', u'_id': u'5e3844a816c3760019f74b72', u'name': u'Defi', u'slug': u'defi'}], u'publishedAt': u'2020-09-30T12:15:21.000Z', u'thumbnail': u'https://cloudfront.cryptocontrol.io/thumbnails/5f7478b33e1e660017eef946-1601468596054.jpg', u'source': {u'url': u'https://news.bitcoin.com/', u'_id': u'59d71c67ef8bf95cc2ab0147', u'name': u'Bitcoin.com', u'favicon': u'https://assets.cryptocontrol.io/favicons/59d71c67ef8bf95cc2ab0147.png'}, u'activityHotness': 0.301623546578, u'words': 1852, u'sourceDomain': u'news.bitcoin.com', u'hotness': 74142.3442624, u'primaryCategory': u'Exchanges', u'originalImageUrl': u'https://news.bitcoin.com/wp-content/uploads/2019/01/jpmorgan-chase-fraud.jpg'}",,,article
83,,"{u'isSelf': False, u'hotness': 74136.4528704, u'coin': u'59d21e9b83a0523906a45db0', u'description': u'', u'title': u'Getting 8.2% APY for lending out my LTC, is anyone else using this?', u'url': u'https://cryptocontrol.io/r/api/reddit/5f74493d17087f0017e0a675?ref=5f963694c3be7e001761fc25', u'downvotes': 0, u'comments': 0, u'subreddit': u'litecoin', u'activityHotness': 0, u'score': 1, u'publishedAt': u'2020-09-30T08:43:02.000Z', u'__v': 0, u'updatedAt': u'2020-09-30T09:00:45.490Z', u'upvotes': 1, u'_id': u'5f74493d17087f0017e0a675', u'id': u'j2igy8', u'createdAt': u'2020-09-30T09:00:45.490Z'}",,reddit
84,,"{u'isSelf': False, u'hotness': 74139.5162946, u'coin': u'59d21e9b83a0523906a45db0', u'description': u'', u'title': u'Litecoin blockchain &amp; LTC is now supported by klever_io! Klever is a 4th gen mobile crypto wallet ecosystem with over 250k DAU &amp; 1.1M total users. LTC holders can Hold, Send, Receive &amp; Charge LTC in Klever.', u'url': u'https://cryptocontrol.io/r/api/reddit/5f74493d17087f0017e0a671?ref=5f963694c3be7e001761fc25', u'downvotes': 0, u'comments': 2, u'subreddit': u'litecoin', u'activityHotness': 3.17805383035, u'score': 3, u'publishedAt': u'2020-09-30T08:01:46.000Z', u'__v': 0, u'updatedAt': u'2020-10-06T16:18:51.653Z', u'upvotes': 21, u'_id': u'5f74493d17087f0017e0a671', u'id': u'j2i0zh', u'createdAt': u'2020-09-30T09:00:45.434Z'}",,reddit
85,"{u'_id': u'5f74427842c71c001815da7b', u'description': u'Laino Group Limited, aka PaxForex, engaged in unlawful retail commodity transactions in ETH, LTC and BTC, the regulator said. [...]
', u'title': u'CFTC pursues digital currency firm for illegal trading', u'url': u'https://cryptocontrol.io/r/api/article/5f74427842c71c001815da7b?ref=5f963694c3be7e001761fc25', u'similarArticles': [{u'title': u'CFTC charges company over offering illegal leveraged transactions in ETH, LTC, BTC', u'url': u'https://cryptocontrol.io/r/api/article/5f720a89c30bb400172b0b7b?ref=5f963694c3be7e001761fc25', u'publishedAt': u'2020-09-28T15:30:37.000Z', u'sourceDomain': u'eng.ambcrypto.com', u'_id': u'5f720a89c30bb400172b0b7b', u'thumbnail': u'https://cloudfront.cryptocontrol.io/thumbnails/5f720a89c30bb400172b0b7b-1601309321288.jpeg'}], u'coins': [{u'tradingSymbol': u'BTC', u'_id': u'59cb59e81c073f09e76f614b', u'name': u'Bitcoin', u'slug': u'bitcoin'}, {u'tradingSymbol': u'LTC', u'_id': u'59d21e9b83a0523906a45db0', u'name': u'Litecoin', u'slug': u'litecoin'}], u'publishedAt': u'2020-09-30T08:00:22.000Z', u'thumbnail': u'https://cloudfront.cryptocontrol.io/thumbnails/5f74427842c71c001815da7b-1601454712870.jpg', u'source': {u'url': u'https://coingeek.com', u'_id': u'5b4b5666c831fd000f6a9178', u'name': u'CoinGeek', u'favicon': u'https://assets.cryptocontrol.io/favicons/5b4b5666c831fd000f6a9178.png'}, u'activityHotness': 1.77173950539, u'words': 381, u'sourceDomain': u'coingeek.com', u'hotness': 74143.1060914, u'primaryCategory': u'Exchanges', u'originalImageUrl': u'https://coingeek.com/wp-content/uploads/2020/09/cftc-pursues-digital-currency-firm-for-illegal-trading.jpg'}",,,article
86,"{u'_id': u'5f7462b317da65001d4029b7', u'description': u'The Lightning Network is a way of handling Bitcoin transactions without the need to verify them on the blockchain. It's designed to speed up verification times and to allow more transactions to take place at the same time.
', u'title': u'What is Lightning Network? And How to Use It in 2020', u'url': u'https://cryptocontrol.io/r/api/article/5f7462b317da65001d4029b7?ref=5f963694c3be7e001761fc25', u'similarArticles': [], u'coins': [{u'tradingSymbol': u'BTC', u'_id': u'59cb59e81c073f09e76f614b', u'name': u'Bitcoin', u'slug': u'bitcoin'}, {u'tradingSymbol': u'blt', u'_id': u'5a7b931702ac032bc997823e', u'name': u'Bitcoin Lightning', u'slug': u'bitcoin-lightning'}, {u'tradingSymbol': u'CHX', u'_id': u'5b7ca78b0c38a700190ebdff', u'name': u'Own', u'slug': u'own'}, {u'tradingSymbol': u'TOP', u'_id': u'5e3844aa16c3760019f74f7b', u'name': u'TOP', u'slug': u'top'}, {u'tradingSymbol': u'DTA', u'_id': u'5a7b931102ac032bc99781f1', u'name': u'DATA', u'slug': u'data'}, {u'tradingSymbol': u'LTC', u'_id': u'59d21e9b83a0523906a45db0', u'name': u'Litecoin', u'slug': u'litecoin'}, {u'tradingSymbol': u'XLM', u'_id': u'59d21e9b83a0523906a45dcb', u'name': u'Stellar Lumens', u'slug': u'stellar'}, {u'tradingSymbol': u'oio', u'_id': u'5c05c3873c4bad0016c2504d', u'name': u'Online', u'slug': u'online'}, {u'tradingSymbol': u'key', u'_id': u'5afcc60ced3b0e000f40d55c', u'name': u'KEY', u'slug': u'key'}, {u'tradingSymbol': u'VIEW', u'_id': u'5b590f068cb221000fcf9eb5', u'name': u'View', u'slug': u'view'}, {u'tradingSymbol': u'JUL', u'_id': u'5e3844a916c3760019f74d2a', u'name': u'Joule', u'slug': u'joule'}, {u'tradingSymbol': u'CREDIT', u'_id': u'5e3844a916c3760019f74c8b', u'name': u'CREDIT', u'slug': u'credit'}, {u'tradingSymbol': u'SEN', u'_id': u'5ac2c404a8134644d0cc0a32', u'name': u'Consensus', u'slug': u'consensus'}, {u'tradingSymbol': u'NET', u'_id': u'5cd36d8270d74700100891ad', u'name': u'NEXT', u'slug': u'next'}], u'publishedAt': u'2020-09-30T08:00:13.000Z', u'thumbnail': u'https://cloudfront.cryptocontrol.io/thumbnails/5f7462b317da65001d4029b7-1601462963865.png', u'source': {u'url': u'https://decryptmedia.com/', u'_id': u'5badd2e80c38a70019e35b97', u'name': u'Decrypt Media', u'favicon': u'https://assets.cryptocontrol.io/favicons/5badd2e80c38a70019e35b97.jpg'}, u'activityHotness': 0.329958058397, u'words': 3041, u'sourceDomain': u'decrypt.co', u'hotness': 74141.6638932, u'primaryCategory': u'General', u'originalImageUrl': u'https://cdn.decrypt.co/resize/1024/height/512/wp-content/uploads/2019/03/lightning_network_litepaper-gID_1-pID_3.png'}",,,article
87,,"{u'isSelf': True, u'hotness': 74138.9798882, u'coin': u'59d21e9b83a0523906a45db0', u'description': u'According to XE dot com 1 Litecoin worth roughly 20 million Bolivars and on that same site 20 million Bolivars is worth roughly 2 million USD???

I'm not getting ny hopes up or anything I own 1.8 Litecoins. I was just wondering if that site is just messed up is all.', u'title': u'Litecoin and Venezuela Bolivar', u'url': u'https://cryptocontrol.io/r/api/reddit/5f74493d17087f0017e0a673?ref=5f963694c3be7e001761fc25', u'downvotes': 0, u'comments': 5, u'subreddit': u'litecoin', u'activityHotness': 2.80336038091, u'score': 3, u'publishedAt': u'2020-09-30T07:03:33.000Z', u'__v': 0, u'updatedAt': u'2020-10-06T16:18:51.653Z', u'upvotes': 9, u'_id': u'5f74493d17087f0017e0a673', u'id': u'j2hcam', u'createdAt': u'2020-09-30T09:00:45.490Z'}",,reddit
88,,"{u'isSelf': True, u'hotness': 74136.2979651, u'coin': u'59d21e9b83a0523906a45db0', u'description': u'i know how to covert to ltc litecoin should i do it or what', u'title': u'should i buy something for my self i have $40 of lbry tokens', u'url': u'https://cryptocontrol.io/r/api/reddit/5f7416cb19f4640019dde4f7?ref=5f963694c3be7e001761fc25', u'downvotes': 0, u'comments': 1, u'subreddit': u'litecoin', u'activityHotness': 0.405465108108, u'score': 1, u'publishedAt': u'2020-09-30T05:21:18.000Z', u'__v': 0, u'updatedAt': u'2020-09-30T20:31:28.086Z', u'upvotes': 0, u'_id': u'5f7416cb19f4640019dde4f7', u'id': u'j2g43a', u'createdAt': u'2020-09-30T05:25:31.970Z'}",,reddit
89,,"{u'isSelf': False, u'hotness': 74137.0204935, u'coin': u'59d21e9b83a0523906a45db0', u'description': u'', u'title': u'LTC and BTC going further into the mainstream. ”Bitcoin of America offers a number of convenient ways to transfer your bitcoin or litecoin to commonly used USD payment gateways like prepaid debit cards or a PayPal account. ”', u'url': u'https://cryptocontrol.io/r/api/reddit/5f73d2d4c0070d0019e856d9?ref=5f963694c3be7e001761fc25', u'downvotes': 0, u'comments': 0, u'subreddit': u'litecoin', u'activityHotness': 1.94591014906, u'score': 1, u'publishedAt': u'2020-09-30T00:26:51.000Z', u'__v': 0, u'updatedAt': u'2020-10-06T16:03:50.555Z', u'upvotes': 7, u'_id': u'5f73d2d4c0070d0019e856d9', u'id': u'j2bpzr', u'createdAt': u'2020-09-30T00:35:32.362Z'}",,reddit
90,,,"{u'username': u'SatoshiLite', u'retweetCount': 0, u'language': u'en', u'links': [], u'__v': 0, u'favoriteCount': 9, u'hashtags': [], u'publishedAt': u'2020-09-29T22:05:51.000Z', u'symbols': [], u'url': u'https://cryptocontrol.io/r/api/tweet/5f73f32b95bbff0017bdbe80?ref=5f963694c3be7e001761fc25', u'activityHotness': 2.09186406168, u'hotness': 74137.7747807, u'isRetweeted': False, u'text': u'@BoilingPointLLC You make it happen! 😁', u'updatedAt': u'2020-09-30T02:53:32.199Z', u'mentions': [u'BoilingPointLLC'], u'_id': u'5f73f32b95bbff0017bdbe80', u'twitteratiScore': 0, u'id': u'1311064675149164544', u'createdAt': u'2020-09-30T02:53:32.199Z', u'coin': u'59d21e9b83a0523906a45db0'}",tweet
91,,"{u'isSelf': False, u'hotness': 74138.3112557, u'coin': u'59d21e9b83a0523906a45db0', u'description': u'', u'title': u'Litecoin in the local news: Important Differences between Bitcoin and Litecoin', u'url': u'https://cryptocontrol.io/r/api/reddit/5f73afafb42b020019e9557f?ref=5f963694c3be7e001761fc25', u'downvotes': 0, u'comments': 7, u'subreddit': u'litecoin', u'activityHotness': 3.70130197411, u'score': 3, u'publishedAt': u'2020-09-29T21:39:35.000Z', u'__v': 0, u'updatedAt': u'2020-10-06T16:18:51.653Z', u'upvotes': 30, u'_id': u'5f73afafb42b020019e9557f', u'id': u'j28ule', u'createdAt': u'2020-09-29T22:05:35.364Z'}",,reddit
92,,,"{u'username': u'SatoshiLite', u'retweetCount': 0, u'language': u'en', u'links': [u'https://twitter.com/i/web/status/1311053894890303488'], u'__v': 0, u'favoriteCount': 30, u'hashtags': [], u'publishedAt': u'2020-09-29T21:23:01.000Z', u'symbols': [], u'url': u'https://cryptocontrol.io/r/api/tweet/5f73f32b95bbff0017bdbe82?ref=5f963694c3be7e001761fc25', u'activityHotness': 3.295836866, u'hotness': 74138.8597721, u'isRetweeted': False, u'text': u'@BoilingPointLLC This existed before SegWit. Maybe I and others used it a bit during the SegWit activation, but it… https://t.co/67e6vd067j', u'updatedAt': u'2020-09-30T02:53:32.199Z', u'mentions': [u'BoilingPointLLC'], u'_id': u'5f73f32b95bbff0017bdbe82', u'twitteratiScore': 0, u'id': u'1311053894890303488', u'createdAt': u'2020-09-30T02:53:32.199Z', u'coin': u'59d21e9b83a0523906a45db0'}",tweet
93,,,"{u'username': u'SatoshiLite', u'retweetCount': 0, u'language': u'en', u'links': [], u'__v': 0, u'favoriteCount': 8, u'hashtags': [], u'publishedAt': u'2020-09-29T21:09:31.000Z', u'symbols': [], u'url': u'https://cryptocontrol.io/r/api/tweet/5f73f32b95bbff0017bdbe83?ref=5f963694c3be7e001761fc25', u'activityHotness': 1.97408102602, u'hotness': 74137.5005162, u'isRetweeted': False, u'text': u'@BoilingPointLLC Which one is the SegWit one?', u'updatedAt': u'2020-09-30T02:53:32.199Z', u'mentions': [u'BoilingPointLLC'], u'_id': u'5f73f32b95bbff0017bdbe83', u'twitteratiScore': 0, u'id': u'1311050498527518720', u'createdAt': u'2020-09-30T02:53:32.199Z', u'coin': u'59d21e9b83a0523906a45db0'}",tweet
94,,"{u'isSelf': True, u'hotness': 74136.2119401, u'coin': u'59d21e9b83a0523906a45db0', u'description': u'I am trying to decide which one of the two/three altcoins I am going to use (Bitcoin, Litecoin, Dash if possible) I should use with the original client instead of its Electrum variant.

How much would I lose on money thanks to fees if I use Electrum instead of Litecoin Core?', u'title': u'Litecoin Core v. Electrum-LTC transaction fees?', u'url': u'https://cryptocontrol.io/r/api/reddit/5f74e41517c78500172d317e?ref=5f963694c3be7e001761fc25', u'downvotes': 0, u'comments': 3, u'subreddit': u'litecoin', u'activityHotness': 2.01490302054, u'score': 2, u'publishedAt': u'2020-09-29T19:10:56.000Z', u'__v': 0, u'updatedAt': u'2020-10-03T06:28:06.076Z', u'upvotes': 3, u'_id': u'5f74e41517c78500172d317e', u'id': u'j2605l', u'createdAt': u'2020-09-30T20:01:25.592Z'}",,reddit
95,,"{u'isSelf': True, u'hotness': 74136.8353771, u'coin': u'59d21e9b83a0523906a45db0', u'description': u'I'll try to keep this short and simple. I mined some Litecoins a few years ago. When I load the olld  Litecoin wallet I installed back then I get the ""URGENT: Alert Key Compromised, upgrade required"" message. 

I backed up my WALLET.DAT file, then I downloaded the new Litecoin core, when I run it I get the message:  “Unable to rewind the database to a pre-fork state. You will need to  download the blockchain. Do you want to rebuild the block database now?” 

I was told in response to an earlier ', u'title': u'Moving coins from old WALLET.DAT to new Litecoin Core', u'url': u'https://cryptocontrol.io/r/api/reddit/5f738ed56371a7001a258dd1?ref=5f963694c3be7e001761fc25', u'downvotes': 0, u'comments': 5, u'subreddit': u'litecoin', u'activityHotness': 2.74084002393, u'score': 1, u'publishedAt': u'2020-09-29T18:34:02.000Z', u'__v': 0, u'updatedAt': u'2020-10-06T10:43:55.971Z', u'upvotes': 8, u'_id': u'5f738ed56371a7001a258dd1', u'id': u'j25922', u'createdAt': u'2020-09-29T19:45:25.100Z'}",,reddit
96,,"{u'isSelf': True, u'hotness': 74135.7173825, u'coin': u'59d21e9b83a0523906a45db0', u'description': u'Litecoin has constantly gotten the short end of the stick. Fud has consumed it over and over again. But, it's value lays in its ability to be the silver to bitcoins gold. Otherwise it is a just a knock off coin. Nobody calls silver knock off, and everyone still likes it. At least most. The more I watch Charlie Lee talk the more I can respect him. Imo litecoin is fine the way it is now, but the marketing needs to be silver to bitcoins gold.', u'title': u'Litecoin gets screwed but...', u'url': u'https://cryptocontrol.io/r/api/reddit/5f72a8e71d53750018872d6b?ref=5f963694c3be7e001761fc25', u'downvotes': 0, u'comments': 41, u'subreddit': u'litecoin', u'activityHotness': 4.1510399059, u'score': 1, u'publishedAt': u'2020-09-29T03:23:53.000Z', u'__v': 0, u'updatedAt': u'2020-10-02T00:56:41.816Z', u'upvotes': 2, u'_id': u'5f72a8e71d53750018872d6b', u'id': u'j1rewt', u'createdAt': u'2020-09-29T03:24:23.071Z'}",,reddit
97,,"{u'isSelf': True, u'hotness': 74132.2155027, u'coin': u'59d21e9b83a0523906a45db0', u'description': u'I argue to use litecoin as a currency unless absolutely necessary is stupid. Same goes for bitcoin. 
To use either of the 2 as a store of value makes sense but then your betting that people use this as a means of storing a portion of their wealth in it. 

To trade litecoin makes sense sorta, but fees to trade are to high to even bother when no exchange for stonks makes you pay a fee. 

I personally believe using bitcoin and litecoin as a stor of value is the best but wouldn't holding btc be bett', u'title': u'Litecoin a sov? A tradeable more volatile asset to hop in and out of? Whats your use case?', u'url': u'https://cryptocontrol.io/r/api/reddit/5f7271ccc53c3f00172f80b0?ref=5f963694c3be7e001761fc25', u'downvotes': 0, u'comments': 2, u'subreddit': u'litecoin', u'activityHotness': 1.60943791243, u'score': 1, u'publishedAt': u'2020-09-28T21:38:11.000Z', u'__v': 0, u'updatedAt': u'2020-10-02T00:56:41.816Z', u'upvotes': 2, u'_id': u'5f7271ccc53c3f00172f80b0', u'id': u'j1ljor', u'createdAt': u'2020-09-28T23:29:16.957Z'}",,reddit
98,,"{u'isSelf': True, u'hotness': 74132.7573938, u'coin': u'59d21e9b83a0523906a45db0', u'description': u'I was listening to a YouTube video with Charlie Lee, which despite what alot of people say I think is probably the best person for lite coin(being that he has no vested stake it in, he's focused on the project alone.) But he said something about the hash rate and why its important to the price via every halving. Thanks in advanced.', u'title': u'Litecoins hashrate vs. Bitcoins hash rate and why they're undervalued?', u'url': u'https://cryptocontrol.io/r/api/reddit/5f7248bba5382b0017f4efdd?ref=5f963694c3be7e001761fc25', u'downvotes': 0, u'comments': 1, u'subreddit': u'litecoin', u'activityHotness': 2.35137525716, u'score': 1, u'publishedAt': u'2020-09-28T20:26:10.000Z', u'__v': 0, u'updatedAt': u'2020-10-05T13:29:37.979Z', u'upvotes': 9, u'_id': u'5f7248bba5382b0017f4efdd', u'id': u'j1k4ke', u'createdAt': u'2020-09-28T20:34:03.943Z'}",,reddit
99,,"{u'isSelf': True, u'hotness': 74131.0396308, u'coin': u'59d21e9b83a0523906a45db0', u'description': u'NEW Pay Depot Bitcoin ATMs at **Gulf Gas Station - PA**

Check out **Gulf Gas Station** to get the lowest possible transaction fees when you buy or sell your cryptocurrency with Pay Depot.

Bitcoin ATMs at **Gulf Gas Station - PA** LOCATIONS:

[1441 W Gordon St,Allentown,PA 18102](https://www.google.com/maps/d/edit?mid=1CRO-cvL9ZFa-4pts0zTRVWiZeCrPmI5r&amp;usp=sharing)

Google Map Link:[https://www.google.com/maps/d/edit?mid=1CRO-cvL9ZFa-4pts0zTRVWiZeCrPmI5r&amp;usp=sharing](https://www.google.c', u'title': u'NEW Pay Depot Litecoin(LTC)/Bitcoin(BTC) ATM Location at Gulf Gas Station - PA', u'url': u'https://cryptocontrol.io/r/api/reddit/5f722ca0963fa10019a97779?ref=5f963694c3be7e001761fc25', u'downvotes': 0, u'comments': 0, u'subreddit': u'litecoin', u'activityHotness': 1.09861228867, u'score': 2, u'publishedAt': u'2020-09-28T17:38:46.000Z', u'__v': 0, u'updatedAt': u'2020-10-04T16:53:42.263Z', u'upvotes': 3, u'_id': u'5f722ca0963fa10019a97779', u'id': u'j1gocr', u'createdAt': u'2020-09-28T18:34:08.270Z'}",,reddit
100,,"{u'isSelf': False, u'hotness': 74131.4737502, u'coin': u'59d21e9b83a0523906a45db0', u'description': u'', u'title': u'CFTC Charges Foreign Trading Platform with Offering Illegal Leveraged Transactions in Ether, Litecoin, and Bitcoin', u'url': u'https://cryptocontrol.io/r/api/reddit/5f720a99c30bb400172b0e14?ref=5f963694c3be7e001761fc25', u'downvotes': 0, u'comments': 0, u'subreddit': u'litecoin', u'activityHotness': 1.79175946923, u'score': 1, u'publishedAt': u'2020-09-28T16:05:31.000Z', u'__v': 0, u'updatedAt': u'2020-10-05T10:34:39.399Z', u'upvotes': 6, u'_id': u'5f720a99c30bb400172b0e14', u'id': u'j1ets7', u'createdAt': u'2020-09-28T16:08:57.891Z'}",,reddit
101,,"{u'isSelf': False, u'hotness': 74133.2738915, u'coin': u'59d21e9b83a0523906a45db0', u'description': u'', u'title': u'Nexo and Litecoin partnership to change the crypto ecosystem', u'url': u'https://cryptocontrol.io/r/api/reddit/5f71e9c5d2caa40017d79db7?ref=5f963694c3be7e001761fc25', u'downvotes': 0, u'comments': 2, u'subreddit': u'litecoin', u'activityHotness': 3.98898404656, u'score': 1, u'publishedAt': u'2020-09-28T13:42:34.000Z', u'__v': 0, u'updatedAt': u'2020-10-06T00:14:37.484Z', u'upvotes': 51, u'_id': u'5f71e9c5d2caa40017d79db7', u'id': u'j1c7uq', u'createdAt': u'2020-09-28T13:48:53.755Z'}",,reddit
102,,"{u'isSelf': True, u'hotness': 74130.4343962, u'coin': u'59d21e9b83a0523906a45db0', u'description': u'i have question about litecoin   
i try to create a new cryptocurrency but i want to use source code of LiteCoin   
what could be the downsides of this? should i use ? i want to hear your thinks', u'title': u'LiteCoin/coin Improvent-develop', u'url': u'https://cryptocontrol.io/r/api/reddit/5f71d4ad10f590001918a9eb?ref=5f963694c3be7e001761fc25', u'downvotes': 0, u'comments': 2, u'subreddit': u'litecoin', u'activityHotness': 1.38629436112, u'score': 1, u'publishedAt': u'2020-09-28T12:17:19.000Z', u'__v': 0, u'updatedAt': u'2020-09-28T14:18:59.074Z', u'upvotes': 1, u'_id': u'5f71d4ad10f590001918a9eb', u'id': u'j1awmm', u'createdAt': u'2020-09-28T12:18:54.054Z'}",,reddit
103,,"{u'isSelf': False, u'hotness': 74129.9947234, u'coin': u'59d21e9b83a0523906a45db0', u'description': u'', u'title': u'Interest in Litecoin is declining, confirmed by the latest statistics', u'url': u'https://cryptocontrol.io/r/api/reddit/5f71c8f685e5970018666873?ref=5f963694c3be7e001761fc25', u'downvotes': 0, u'comments': 2, u'subreddit': u'litecoin', u'activityHotness': 1.09861228867, u'score': 0, u'publishedAt': u'2020-09-28T11:22:36.000Z', u'__v': 0, u'updatedAt': u'2020-09-28T12:18:54.061Z', u'upvotes': 0, u'_id': u'5f71c8f685e5970018666873', u'id': u'j1a6y6', u'createdAt': u'2020-09-28T11:28:54.872Z'}",,reddit
104,,"{u'isSelf': True, u'hotness': 74130.0209113, u'coin': u'59d21e9b83a0523906a45db0', u'description': u'LTC’s growing hash rate :)', u'title': u'LTC’s growing hash rate :) https://bitinfocharts.com/comparison/litecoin-hashrate.html', u'url': u'https://cryptocontrol.io/r/api/reddit/5f712f5a5d34b50017c611ef?ref=5f963694c3be7e001761fc25', u'downvotes': 0, u'comments': 6, u'subreddit': u'litecoin', u'activityHotness': 3.04452243772, u'score': 4, u'publishedAt': u'2020-09-27T23:51:30.000Z', u'__v': 0, u'updatedAt': u'2020-10-02T23:37:42.959Z', u'upvotes': 12, u'_id': u'5f712f5a5d34b50017c611ef', u'id': u'j11j3z', u'createdAt': u'2020-09-28T00:33:30.561Z'}",,reddit
